ResourceID,brocade.id,card,order,source_field,source_code,Annotation,Annotation Language,Annotation Type
88e66caf-a01c-587d-8011-19fab6278941,tg:lhaq:6891,e73_AnnotationsImmaterial,1,adm.note,"**Opvoering:** KNS van Antwerpen, 90ste speeljaar, mei 1943

**Regie:** Joris Diels","**Opvoering:** KNS van Antwerpen, 90ste speeljaar, mei 1943

**Regie:** Joris Diels",Nederlands,remarks
6bc05a1d-3944-525a-beb5-09a3d9ab99db,tg:lhaq:8937,e73_AnnotationsImmaterial,1,adm.note,"De rollen van de drie wachters werden  door de acteurs Lode van Beek, Ward de Ravet en Piet Van den Bosch vertolkt.","De rollen van de drie wachters werden  door de acteurs Lode van Beek, Ward de Ravet en Piet Van den Bosch vertolkt.",Nederlands,remarks
bf88cfb6-f431-5418-a71f-a37074a5f5f7,tg:lhaq:8927,e73_AnnotationsImmaterial,1,adm.note,"De rol van Paris, een jong edelman, werd  door de acteur Paul 's Jongers vertolkt.","De rol van Paris, een jong edelman, werd  door de acteur Paul 's Jongers vertolkt.",Nederlands,remarks
f61b2acc-303d-5428-a19e-8cfcdbf0eba2,tg:lhaq:9018,e73_AnnotationsImmaterial,1,adm.note,De rol van Raina Petkoff werd door de actrice Denise Zimmermann vertolkt.,De rol van Raina Petkoff werd door de actrice Denise Zimmermann vertolkt.,Nederlands,remarks
9b000f80-5b64-5386-992c-edf855837ac7,tg:lhaq:8911,e73_AnnotationsImmaterial,1,adm.note,De rol van Schwejk werd door de acteur Luc Philips vertolkt.,De rol van Schwejk werd door de acteur Luc Philips vertolkt.,Nederlands,remarks
77628abe-48bc-56c8-90b0-f74a14b189bd,tg:lhaq:8879,e73_AnnotationsImmaterial,1,adm.note,De rollen van de joffers werden  door de actrices Sonia Dooms en Wilma Geurts vertolkt.,De rollen van de joffers werden  door de actrices Sonia Dooms en Wilma Geurts vertolkt.,Nederlands,remarks
976f8177-daf0-5700-86dd-bd5fd04fe743,tg:lhaq:8973,e73_AnnotationsImmaterial,1,adm.note,"De rol van de neef van Katharina, een burger, werd door de acteur Paul 's Jongers vertolkt.","De rol van de neef van Katharina, een burger, werd door de acteur Paul 's Jongers vertolkt.",Nederlands,remarks
d6852c9e-2fcf-5c73-8359-c36a856124aa,tg:lhaq:8963,e73_AnnotationsImmaterial,1,adm.note,"De rol van Katherina Sheermertens, een jonge maagd, werd door de actrice Tine Balder vertolkt.","De rol van Katherina Sheermertens, een jonge maagd, werd door de actrice Tine Balder vertolkt.",Nederlands,remarks
c63bf385-e26d-556d-9968-5412a621b666,tg:lhaq:6976,e73_AnnotationsImmaterial,1,adm.note,Verso: Schets van een ruiten wassende vrouw,Verso: Schets van een ruiten wassende vrouw,Nederlands,remarks
e21d7750-6df2-5448-a023-630d895c816c,tg:lhaq:8856,e73_AnnotationsImmaterial,1,adm.note,De rol van Maen werd door de  actrice Martha de Wachter vertolkt.,De rol van Maen werd door de  actrice Martha de Wachter vertolkt.,Nederlands,remarks
3906e21c-cee0-56ec-b640-4e92ef4a6981,tg:lhaq:6821,e73_AnnotationsImmaterial,1,adm.note,"**Publicatie** Cnodder, De, Remi - Ferket, Chris [samenstellers], _Diligence 1976_. Antwerpen, Stichting Oranjehuis, 1976, 12 p. waarvan 10 originele manuscripten met 9 originele illustraties. **Historiek:** Op 9 oktober 1976 vond in het Oranjehuis te Antwerpen de eerste _Diligence_ plaats, enkele tientallen dichters en schilders schreven en illustreerden er in aanwezigheid van het publiek _Diligence 1976_. De originele werken werden gebundeld in exclusieve mappen die elk 10 geïllustreerde gedichten bevatten. De initiatiefnemers waren Chris Ferket en Remi de Cnodder.","**Publicatie** Cnodder, De, Remi - Ferket, Chris [samenstellers], _Diligence 1976_. Antwerpen, Stichting Oranjehuis, 1976, 12 p. waarvan 10 originele manuscripten met 9 originele illustraties. **Historiek:** Op 9 oktober 1976 vond in het Oranjehuis te Antwerpen de eerste _Diligence_ plaats, enkele tientallen dichters en schilders schreven en illustreerden er in aanwezigheid van het publiek _Diligence 1976_. De originele werken werden gebundeld in exclusieve mappen die elk 10 geïllustreerde gedichten bevatten. De initiatiefnemers waren Chris Ferket en Remi de Cnodder.",Nederlands,remarks
fe5263f1-2f5e-5ae8-896d-96c85039aabf,tg:lhaq:8834,e73_AnnotationsImmaterial,1,adm.note,"De rollen van snollen werden door de actrices Marilou Mermans, Martha de Wachter en Tine Balder vertolkt.","De rollen van snollen werden door de actrices Marilou Mermans, Martha de Wachter en Tine Balder vertolkt.",Nederlands,remarks
638739d8-5291-57ed-b0bc-2b36ca02ff30,tg:lhaq:6888,e73_AnnotationsImmaterial,1,adm.note,"**Opvoering:** KNS van Antwerpen, 90ste speeljaar, oktober 1942

**Regie:** Joris Diels","**Opvoering:** KNS van Antwerpen, 90ste speeljaar, oktober 1942

**Regie:** Joris Diels",Nederlands,remarks
d87afbaa-f5d0-53b5-92ae-95f70e3ffa68,tg:lhpa:364,e73_AnnotationsImmaterial,1,adm.note,Frans Verschoren dankt Opsomer voor dit portret in een brief van 24.9.1941,Frans Verschoren dankt Opsomer voor dit portret in een brief van 24.9.1941,Nederlands,remarks
b24df03d-8a1f-5471-8c09-9c6d740a95a0,tg:lhpa:223,e73_AnnotationsImmaterial,1,adm.note,"Op versozijde lijst kleeft een briefje:

""Legaat Dame Anna Devos, Wwe Emiel Hullebroeck (overleden te Liedekerke op 11
mei 1966) - volgens testamentaire beschikking - inventaris en documenten:
afdeling boekhouding","Op versozijde lijst kleeft een briefje:

""Legaat Dame Anna Devos, Wwe Emiel Hullebroeck (overleden te Liedekerke op 11
mei 1966) - volgens testamentaire beschikking - inventaris en documenten:
afdeling boekhouding",Nederlands,remarks
75a14750-7df5-5455-9530-ae416de70e80,tg:lhpa:339,e73_AnnotationsImmaterial,1,adm.note,Datering in potlood op de lijst,Datering in potlood op de lijst,Nederlands,remarks
7aff0d22-91f7-5716-97fc-d9ed620392df,tg:lhpa:9764,e73_AnnotationsImmaterial,1,adm.note,preciosa,preciosa,Nederlands,remarks
73c27de9-5a9b-56e5-9a1b-af444dc441c4,tg:lhpa:75,e73_AnnotationsImmaterial,1,adm.note,De versozijde is een ander schilderij: Vaas met bloemen,De versozijde is een ander schilderij: Vaas met bloemen,Nederlands,remarks
dbfb8ab1-4a4e-5293-b038-1a2e7bd7dd9b,tg:lhpa:330,e73_AnnotationsImmaterial,1,adm.note,"De (waarschijnlijk eigen) handtekening van de schilder werd achteraf aangebracht met een balpen. Een foto van het doek (A.C.L. nr. 165986; AMVC 58.317, ingeschreven op 13.11.1957) toont geen handtekening op die plaats","De (waarschijnlijk eigen) handtekening van de schilder werd achteraf aangebracht met een balpen. Een foto van het doek (A.C.L. nr. 165986; AMVC 58.317, ingeschreven op 13.11.1957) toont geen handtekening op die plaats",Nederlands,remarks
77a8e73e-8a01-50b1-81a3-c6a65a3db497,tg:lhpa:258,e73_AnnotationsImmaterial,1,adm.note,"Op de achterzijde van het paneel staat: _Piet Verhaert

geb. 1852 Antwerpen, leraar a/d kon. Kunstacademie aldaar + 4 aug. 1908

Binnenhuisje_","Op de achterzijde van het paneel staat: _Piet Verhaert

geb. 1852 Antwerpen, leraar a/d kon. Kunstacademie aldaar + 4 aug. 1908

Binnenhuisje_",Nederlands,remarks
630abf13-730a-509e-b98e-7c6c744a8845,tg:lhpa:9765,e73_AnnotationsImmaterial,1,adm.note,preciosa,preciosa,Nederlands,remarks
16142d6f-6255-5d76-b4ee-aef6e8dc8f4c,tg:lhpa:590,e73_AnnotationsImmaterial,1,adm.note,paneel met doekstructuur tegen spieraam gekleefd,paneel met doekstructuur tegen spieraam gekleefd,Nederlands,remarks
828fcfc4-86da-5046-ac76-5170f8e94e10,tg:lhpa:6006,e73_AnnotationsImmaterial,1,adm.note,"Portret gemaakt n.a.v. de tentoonstelling: Schrijversportretten ingericht door de KASKA, April 2005.","Portret gemaakt n.a.v. de tentoonstelling: Schrijversportretten ingericht door de KASKA, April 2005.",Nederlands,remarks
eac947bc-0f3c-5c03-985b-5975404120eb,tg:lhpa:259,e73_AnnotationsImmaterial,1,adm.note,"Rechtsboven staan een aantal onleesbare woorden.

Twee bruine strepen verdelen het doek in kruisvorm, en een aantal onleesbare
woorden lopen zelfs uit op het aangezicht. (palimpsest?)","Rechtsboven staan een aantal onleesbare woorden.

Twee bruine strepen verdelen het doek in kruisvorm, en een aantal onleesbare
woorden lopen zelfs uit op het aangezicht. (palimpsest?)",Nederlands,remarks
1607e582-00e3-5937-923d-f275f38d5c6f,tg:lhpa:74,e73_AnnotationsImmaterial,1,adm.note,"De versozijde is een schilderij met als tekst: _Gaston Burssens door Jan
Burssens 1954_","De versozijde is een schilderij met als tekst: _Gaston Burssens door Jan
Burssens 1954_",Nederlands,remarks
d925b2bc-887a-5a0b-924e-559d4f3fdfcc,tg:lhpa:398,e73_AnnotationsImmaterial,1,adm.note,"**Publicatie** Paneel in Franse eik, ondergrond rechtstreeks in bladgoud, vervolgens gepolychromeerd en bovenop met goudlijnen belegd. Versierd met halfedelstenen, 5 granaat en 4 zirkonia, verankerd door chatons in gerhodieerd zilver. **Iconacee:** (Lat.) ikoonachtig of van de familie van de iconen **Voorstudie:** iconografie nr. 3718i","**Publicatie** Paneel in Franse eik, ondergrond rechtstreeks in bladgoud, vervolgens gepolychromeerd en bovenop met goudlijnen belegd. Versierd met halfedelstenen, 5 granaat en 4 zirkonia, verankerd door chatons in gerhodieerd zilver. **Iconacee:** (Lat.) ikoonachtig of van de familie van de iconen **Voorstudie:** iconografie nr. 3718i",Nederlands,remarks
3abcc617-c81a-5898-8563-a00839ec0dfd,tg:lhpa:634,e73_AnnotationsImmaterial,1,adm.note,"Edouard Huberti noemde Marie Elizabeth Belpaire ook Mieke in zijn brieven aan haar. **Publicatie** Belpaire, Marie Elizabeth, _Kunst- en levensbeelden_. Antwerpen: Buschmann, 1913, 2de druk, p. 291.","Edouard Huberti noemde Marie Elizabeth Belpaire ook Mieke in zijn brieven aan haar. **Publicatie** Belpaire, Marie Elizabeth, _Kunst- en levensbeelden_. Antwerpen: Buschmann, 1913, 2de druk, p. 291.",Nederlands,remarks
e802f5ad-3278-5fec-998d-7632992171a0,tg:lhpa:144,e73_AnnotationsImmaterial,1,adm.note,"Opdracht op de lijst m.o. (op koperplaat):

_Den Heer Frans van Doeselaer

Bestuurder van den Nederlandschen Schouwburg op zijn vijftigjarig Jubelfeest

namens zijn vereerders aangeboden door den

Zuid-Nederlandschen Tooneelbond

Antwerpen 11 novembver 1897_","Opdracht op de lijst m.o. (op koperplaat):

_Den Heer Frans van Doeselaer

Bestuurder van den Nederlandschen Schouwburg op zijn vijftigjarig Jubelfeest

namens zijn vereerders aangeboden door den

Zuid-Nederlandschen Tooneelbond

Antwerpen 11 novembver 1897_",Nederlands,remarks
520cfdf9-6367-55d3-b906-8b1b8ecacb71,tg:lhpa:154,e73_AnnotationsImmaterial,1,adm.note,De drager is mogelijk geolied papier,De drager is mogelijk geolied papier,Nederlands,remarks
2c6ffaa2-be8a-523f-b42b-55808279a920,tg:lhpa:250,e73_AnnotationsImmaterial,1,adm.note,"Op de achterzijde van het schilderij kleeft een stukje papier met de tekst
_Pieter de Mets 1908_ en een onleesbare handtekening.","Op de achterzijde van het schilderij kleeft een stukje papier met de tekst
_Pieter de Mets 1908_ en een onleesbare handtekening.",Nederlands,remarks
e1568096-39d6-51aa-b4fa-74db438bf157,tg:lhpa:9767,e73_AnnotationsImmaterial,1,adm.note,preciosa,preciosa,Nederlands,remarks
5c3f17b7-ed76-5566-a33f-9622a6353c6b,tg:lhpa:280,e73_AnnotationsImmaterial,1,adm.note,"Het doek kan met vrij grote zekerheid rond 1859 gedateerd worden, omdat het tegenhangend protret van Hendrik Conscience, gedateerd 1859, dezelfde vorm, formaat en lijst heeft, hetgeen wijst op een vermoedelijk gelijktijdig ontstaan.","Het doek kan met vrij grote zekerheid rond 1859 gedateerd worden, omdat het tegenhangend protret van Hendrik Conscience, gedateerd 1859, dezelfde vorm, formaat en lijst heeft, hetgeen wijst op een vermoedelijk gelijktijdig ontstaan.",Nederlands,remarks
ea0d814d-9d9a-5fa5-9001-c332d7dfbe01,tg:lhpa:289,e73_AnnotationsImmaterial,1,adm.note,Hangt in de trapzaal naar het auditorium.,Hangt in de trapzaal naar het auditorium.,Nederlands,remarks
a6ccb6a7-80ee-526b-a4f1-9526d249fc22,tg:lhpa:146,e73_AnnotationsImmaterial,1,adm.note,"Hoort samen met een schilderij van mevrouw P. Ecrevisse, zelfde formaat, zelfde datering","Hoort samen met een schilderij van mevrouw P. Ecrevisse, zelfde formaat, zelfde datering",Nederlands,remarks
cdd56d09-17d0-5bdd-8956-8ee25cb93fb2,tg:lhpa:6902,e73_AnnotationsImmaterial,1,adm.note,Planex GP / Glasramen,Planex GP / Glasramen,Nederlands,remarks
8b2e4ee9-e90d-553a-8a74-6e2586bd534a,tg:lhpa:304,e73_AnnotationsImmaterial,1,adm.note,"Misschien is dit een voorstudie van Schaefels' grotere werk ""De Algesiras in de zeeslag van Trafalgar in 1807"" (129 x 200), dat van hetzelfde jaar is en in het KMSKA hangt.","Misschien is dit een voorstudie van Schaefels' grotere werk ""De Algesiras in de zeeslag van Trafalgar in 1807"" (129 x 200), dat van hetzelfde jaar is en in het KMSKA hangt.",Nederlands,remarks
5d799081-d85a-591f-9ab2-f9cad8cb2240,tg:lhpa:147,e73_AnnotationsImmaterial,1,adm.note,"Hoort samen met een schilderij van Peter Ecrevisse, zelfde formaat, zelfde datering","Hoort samen met een schilderij van Peter Ecrevisse, zelfde formaat, zelfde datering",Nederlands,remarks
0dc492ef-573d-54f2-a2d0-5ae837a03c55,tg:lhpa:157,e73_AnnotationsImmaterial,1,adm.note,Geschilderd naar een foto van Julien Ganz (35400p),Geschilderd naar een foto van Julien Ganz (35400p),Nederlands,remarks
069a2ce7-6fa8-5075-aad1-a09776c3bd1e,tg:lhpa:231,e73_AnnotationsImmaterial,1,adm.note,"De opdracht en de herdenkingsdata op het schilderij houden
hoogstwaarschijnlijk verband met de publikatie van de studie _Pieter Frans van
Kerckhoven_ door Lode Baekelmans en het uitgeven van het werk _Jonker Willem_
door P.F. van Kerckhoven.","De opdracht en de herdenkingsdata op het schilderij houden
hoogstwaarschijnlijk verband met de publikatie van de studie _Pieter Frans van
Kerckhoven_ door Lode Baekelmans en het uitgeven van het werk _Jonker Willem_
door P.F. van Kerckhoven.",Nederlands,remarks
a076559e-3488-5795-96f3-8774d76d10ac,tg:lhpa:298,e73_AnnotationsImmaterial,1,adm.note,"Dit doek is een later uitgesneden en ingelijst fragment van het portret van Mevr. van Rijswijck, dat eveneens in het AMVC bewaard wordt .","Dit doek is een later uitgesneden en ingelijst fragment van het portret van Mevr. van Rijswijck, dat eveneens in het AMVC bewaard wordt .",Nederlands,remarks
a785297c-6cb8-5ee3-8ea9-5ea11aea07fa,tg:lhpa:288,e73_AnnotationsImmaterial,1,adm.note,Kopie naar het Rubensportret in het Rubenshuis,Kopie naar het Rubensportret in het Rubenshuis,Nederlands,remarks
a0441b55-6ffd-5e38-bec1-d2aad4118f9b,tg:lhpa:6005,e73_AnnotationsImmaterial,1,adm.note,"Toen ik nog zeer jong was, werd vader ziek en gingen we buiten wonen in Oude God. We woonden daar drie jaar in een klein werkmanshuisje"". (Ida Wasserman in ""Ten huize Van"" (deel 6, 1970), p. 47.)","Toen ik nog zeer jong was, werd vader ziek en gingen we buiten wonen in Oude God. We woonden daar drie jaar in een klein werkmanshuisje"". (Ida Wasserman in ""Ten huize Van"" (deel 6, 1970), p. 47.)",Nederlands,remarks
0fca160f-10c8-5e1d-8a30-e69109f971cf,tg:lhpa:161,e73_AnnotationsImmaterial,1,adm.note,Ingelijst en achter glas,Ingelijst en achter glas,Nederlands,remarks
35905dd3-37e7-5e9a-9982-59a05387f272,tg:lhpa:9766,e73_AnnotationsImmaterial,1,adm.note,preciosa,preciosa,Nederlands,remarks
660e9b72-1576-5091-b0d3-a5739be50594,tg:lhpa:48,e73_AnnotationsImmaterial,1,adm.note,"Op Belpaires 95ste verjaardag, op 31 januari 1948, bracht koningin Elisabeth de feestelinge een onofficieel bezoek van een half uur, waarna de koningin deelnam aan de artiestenmis in de Carolus Borromeuskerk. **Publicatie** Dereere, Aline - Beeck, van, Helga [red.], _Marie Elisabeth Belpaire (1853-1948). Facetten van een levenswerk_. Antwerpen: Stichting Marie Elisabeth Belpaire, 2002, p. 161.","Op Belpaires 95ste verjaardag, op 31 januari 1948, bracht koningin Elisabeth de feestelinge een onofficieel bezoek van een half uur, waarna de koningin deelnam aan de artiestenmis in de Carolus Borromeuskerk. **Publicatie** Dereere, Aline - Beeck, van, Helga [red.], _Marie Elisabeth Belpaire (1853-1948). Facetten van een levenswerk_. Antwerpen: Stichting Marie Elisabeth Belpaire, 2002, p. 161.",Nederlands,remarks
15ff8933-91cc-524f-a9e8-6579edbb83e2,tg:lhpa:3396,e73_AnnotationsImmaterial,1,adm.note,Opdracht van E. Laermans aan G. Eekhoud.,Opdracht van E. Laermans aan G. Eekhoud.,Nederlands,remarks
161deb46-f386-52f6-a156-9c27ad1cfe0d,tg:lhpa:238,e73_AnnotationsImmaterial,1,adm.note,De signatuur moet gelezen worden als _Kathy_ [Dickinson door] _Leclercq_,De signatuur moet gelezen worden als _Kathy_ [Dickinson door] _Leclercq_,Nederlands,remarks
540ab951-7f48-5653-ae4b-c545ee5a4e1b,tg:lhpa:291,e73_AnnotationsImmaterial,1,adm.note,"Op de achterzijde is een nota gekleefd: _Portret van Mevr. Ruisbroek / geb.
Maria Josepha Ten Voorden / Merxem 27 maart 1860 + Schaarbeek 16.XIII.1945 /
Toneelkunstenares verbonden o.m. aan de K.N.S. / Antwerpen, waar zij op 6 mei
1930 haar 50 jarig toneeljubileum vierde. / Dit portret werd geschilderd door
haar man / Bernard J. Ruisbroek, die eveneens lange jaren / aan de K.N.S.
Antwerpen verbonden was._","Op de achterzijde is een nota gekleefd: _Portret van Mevr. Ruisbroek / geb.
Maria Josepha Ten Voorden / Merxem 27 maart 1860 + Schaarbeek 16.XIII.1945 /
Toneelkunstenares verbonden o.m. aan de K.N.S. / Antwerpen, waar zij op 6 mei
1930 haar 50 jarig toneeljubileum vierde. / Dit portret werd geschilderd door
haar man / Bernard J. Ruisbroek, die eveneens lange jaren / aan de K.N.S.
Antwerpen verbonden was._",Nederlands,remarks
00283f9e-6840-5768-a91c-005ac3ee3501,tg:lhpa:15,e73_AnnotationsImmaterial,1,adm.note,"Ingelijst in verzilverd medaillon
De drager is niet zeker.","Ingelijst in verzilverd medaillon
De drager is niet zeker.",Nederlands,remarks
0e1c3287-e1ac-5213-8d37-2f8867310ab1,tg:lhpa:9759,e73_AnnotationsImmaterial,1,adm.note,preciosa,preciosa,Nederlands,remarks
f0e9e483-717b-5567-a0f2-8632975892fa,tg:lhpa:96,e73_AnnotationsImmaterial,1,adm.note,"Datering door Dillens zelf in een brief aan de Antwerpse stadssecretaris, die het stuk doorgaf aan Stadsbibliothecaris Emmanuel de Bom (16.4.1912)","Datering door Dillens zelf in een brief aan de Antwerpse stadssecretaris, die het stuk doorgaf aan Stadsbibliothecaris Emmanuel de Bom (16.4.1912)",Nederlands,remarks
c2d21a04-8dee-5bf8-b732-f07473b3235b,tg:lhpa:7384,e73_AnnotationsImmaterial,1,adm.note,"12/02//2007: Goed, opliggend vuil.","12/02//2007: Goed, opliggend vuil.",Nederlands,remarks
5697932c-efc5-52cf-ae81-2d175d8e661f,tg:lhpa:9763,e73_AnnotationsImmaterial,1,adm.note,preciosa,preciosa,Nederlands,remarks
253dfe52-3ca0-5ed8-986f-aa6661e932d4,tg:lhpa:256,e73_AnnotationsImmaterial,1,adm.note,Achter plexi,Achter plexi,Nederlands,remarks
e7cfcc2f-93d3-53f7-92cd-6e0439c0fc0c,tg:lhpa:301,e73_AnnotationsImmaterial,1,adm.note,Het doek is gekleefd op karton,Het doek is gekleefd op karton,Nederlands,remarks
380604e6-4b08-5204-8d9c-60b92c10da55,tg:lhpa:44,e73_AnnotationsImmaterial,1,adm.note,Toegeschreven aan O. Troost,Toegeschreven aan O. Troost,Nederlands,remarks
dfcba7d3-2553-5453-b4fc-e043ee65b570,tg:lhpa:36,e73_AnnotationsImmaterial,1,adm.note,"Lode Baekelmans heeft zelf beweerd dat het portret een voorouder voorstelt, maar dat wordt nergens bevestigd.","Lode Baekelmans heeft zelf beweerd dat het portret een voorouder voorstelt, maar dat wordt nergens bevestigd.",Nederlands,remarks
bd87811a-f6a4-5342-a410-26f67531ceb0,tg:lhpa:640,e73_AnnotationsImmaterial,1,adm.note,"Edouard Huberti noemde Marie Elizabeth Belpaire ook Mieke in zijn brieven aan haar. **Publicatie** Belpaire, Marie Elizabeth, _Kunst- en levensbeelden_. Antwerpen: Buschmann, 1913, 2de druk, p. 291.","Edouard Huberti noemde Marie Elizabeth Belpaire ook Mieke in zijn brieven aan haar. **Publicatie** Belpaire, Marie Elizabeth, _Kunst- en levensbeelden_. Antwerpen: Buschmann, 1913, 2de druk, p. 291.",Nederlands,remarks
3c9ca83d-4a36-5353-ab1e-ed6bd1564e09,tg:lhpa:143,e73_AnnotationsImmaterial,1,adm.note,"Op 1.1.1889 is de laatste vertoning gespeeld van _Robert en Bertrand_ met Van
Doeselaer in de hoofdrol. Vandaar de datering.","Op 1.1.1889 is de laatste vertoning gespeeld van _Robert en Bertrand_ met Van
Doeselaer in de hoofdrol. Vandaar de datering.",Nederlands,remarks
3dcab50d-8b5e-5572-872c-529c826e9b4a,tg:lhpa:268,e73_AnnotationsImmaterial,1,adm.note,Kopie van het origineel door Jef de Smedt,Kopie van het origineel door Jef de Smedt,Nederlands,remarks
d27263aa-d8ef-55a7-b58f-198ef787ff2c,tg:lhpa:641,e73_AnnotationsImmaterial,1,adm.note,"Chérisy was de bijnaam van Edouard Huberti in de familie Teichmann-Belpaire. **Publicatie** Belpaire, Marie Elizabeth, _Kunst- en levensbeelden_. Antwerpen: Buschmann, 1913, 2de druk, p. 275.","Chérisy was de bijnaam van Edouard Huberti in de familie Teichmann-Belpaire. **Publicatie** Belpaire, Marie Elizabeth, _Kunst- en levensbeelden_. Antwerpen: Buschmann, 1913, 2de druk, p. 275.",Nederlands,remarks
ac0ec8cc-526d-5952-81b8-3cd77ea1f3d9,tg:lhpa:7361,e73_AnnotationsImmaterial,1,adm.note,"09-02-2007: Matig, verf is her en der uitgeveegd.","09-02-2007: Matig, verf is her en der uitgeveegd.",Nederlands,remarks
fca9bbe2-3e7b-5fca-99bf-2a0579733dd1,tg:lhpa:295,e73_AnnotationsImmaterial,1,adm.note,"Een lijst van schilderijen in het bezit van de familie Buschmann, opgemaakt in 1957 met het oog op een aankoop door het museum, vermeldt ca. 1896 als datering.","Een lijst van schilderijen in het bezit van de familie Buschmann, opgemaakt in 1957 met het oog op een aankoop door het museum, vermeldt ca. 1896 als datering.",Nederlands,remarks
7490c5f8-4ccc-5d9d-832a-3682a6042a82,tg:lhpa:326,e73_AnnotationsImmaterial,1,adm.note,De datum _42_ is toegvoegd en behoort niet tot de handtekening.,De datum _42_ is toegvoegd en behoort niet tot de handtekening.,Nederlands,remarks
0aac98cc-88b4-558f-8a68-49f01a96434a,tg:lhpa:63,e73_AnnotationsImmaterial,1,adm.note,"In een brief aan Fred Bogaerts (26.4.1928) schrijft De Troyer: ""Liever had ik U een of anderen dag een kop te schilderen als u er belang in stelt en als u soms een dag vrijhebt.","In een brief aan Fred Bogaerts (26.4.1928) schrijft De Troyer: ""Liever had ik U een of anderen dag een kop te schilderen als u er belang in stelt en als u soms een dag vrijhebt.",Nederlands,remarks
9caf1df5-8ef6-5b6b-86f6-b6a442a126d5,tg:lhpa:97,e73_AnnotationsImmaterial,1,adm.note,Op de achterzijde is een doodsbrief van Conscience gekleefd,Op de achterzijde is een doodsbrief van Conscience gekleefd,Nederlands,remarks
ff1e2028-1b25-525a-9195-e81a00c2901e,tg:lhpa:9762,e73_AnnotationsImmaterial,1,adm.note,preciosa,preciosa,Nederlands,remarks
2fcd268a-b9fb-590e-bc48-50f97a4d4768,tg:lhpa:245,e73_AnnotationsImmaterial,1,adm.note,"Ingelijst. De randen van het doek werden vermoedelijk afgeknipt, zeker onderaan: de vermelding 'Souvenir respe[ctueux]', gevat in een wimpel is gedeeltelijk weggeknipt. He't doek werd op karton gekleefd.","Ingelijst. De randen van het doek werden vermoedelijk afgeknipt, zeker onderaan: de vermelding 'Souvenir respe[ctueux]', gevat in een wimpel is gedeeltelijk weggeknipt. He't doek werd op karton gekleefd.",Nederlands,remarks
c7effd59-b62c-5834-8369-c550818006f0,tg:lhpa:3685,e73_AnnotationsImmaterial,1,adm.note,"Deze plaat hing boven de deur van de studeerkamer van R. Stijns om (door Lea, zijn kleindochter, met schalkse lach gezegd) een barst in de muur te bedekken.","Deze plaat hing boven de deur van de studeerkamer van R. Stijns om (door Lea, zijn kleindochter, met schalkse lach gezegd) een barst in de muur te bedekken.",Nederlands,remarks
0f922a55-40bd-54e3-8a61-c8c9d5399a55,tg:lhpa:35,e73_AnnotationsImmaterial,1,adm.note,"Lode Baekelmans heeft zelf beweerd dat het portret een voorouder voorstelt, maar dat wordt nergens bevestigd.","Lode Baekelmans heeft zelf beweerd dat het portret een voorouder voorstelt, maar dat wordt nergens bevestigd.",Nederlands,remarks
4e9fb7d6-8cc9-5f2b-8fbf-cc863abf483b,tg:lhpa:8105,e73_AnnotationsImmaterial,1,adm.note,onafgewerkt,onafgewerkt,Nederlands,remarks
81ac3b6d-8ded-589d-b925-44f68b69c7af,tg:lhpa:287,e73_AnnotationsImmaterial,1,adm.note,Anonieme kopie naar het origineel van P.P. Rubens in het Kon. Museum voor Schone Kunsten te Brussel.,Anonieme kopie naar het origineel van P.P. Rubens in het Kon. Museum voor Schone Kunsten te Brussel.,Nederlands,remarks
f69a59f2-834d-5354-b521-170736dbb704,tg:lhpa:356,e73_AnnotationsImmaterial,1,adm.note,Op de lijst kleeft een vers van La Fontaine,Op de lijst kleeft een vers van La Fontaine,Nederlands,remarks
1e93b1a4-f885-5b05-bc58-208441943647,tg:lhpa:105,e73_AnnotationsImmaterial,1,adm.note,"Mej. Maria Bonquet schrijft in een brief van 29.9.1974: ""Het boerenhuisje: dat is een geschenk als dank voor mijn voordracht over Pastoor De Craene en zijn werk, in een onderwijsinstituut. Dat was in het jaar 1935. De Pastoor vond dat zulk mooi gebaar dat hij er een gedicht op maakte. Dat gedicht ""De vriendschap bracht"" staat op de keerzijde van de schilderij.","Mej. Maria Bonquet schrijft in een brief van 29.9.1974: ""Het boerenhuisje: dat is een geschenk als dank voor mijn voordracht over Pastoor De Craene en zijn werk, in een onderwijsinstituut. Dat was in het jaar 1935. De Pastoor vond dat zulk mooi gebaar dat hij er een gedicht op maakte. Dat gedicht ""De vriendschap bracht"" staat op de keerzijde van de schilderij.",Nederlands,remarks
13100158-f6ee-5444-b493-e8e364480444,tg:lhpa:9760,e73_AnnotationsImmaterial,1,adm.note,preciosa,preciosa,Nederlands,remarks
200f777c-eb8e-576e-8d72-d5f259fcc537,tg:lhpa:638,e73_AnnotationsImmaterial,1,adm.note,"Chérisy was de bijnaam van Edouard Huberti in de familie Teichmann-Belpaire. **Publicatie** Belpaire, Marie Elizabeth, _Kunst- en levensbeelden_. Antwerpen: Buschmann, 1913, 2de druk, p. 275.","Chérisy was de bijnaam van Edouard Huberti in de familie Teichmann-Belpaire. **Publicatie** Belpaire, Marie Elizabeth, _Kunst- en levensbeelden_. Antwerpen: Buschmann, 1913, 2de druk, p. 275.",Nederlands,remarks
0d620214-f001-5db5-afef-540fa0087003,tg:lhpa:263,e73_AnnotationsImmaterial,1,adm.note,Portret achter glas,Portret achter glas,Nederlands,remarks
