ResourceID,brocade.id,card,order,source_field,Description,Description Type,Description Language
87f1da4a-cb17-5cf3-9328-8d02ecfe9bbe,tg:lhdc:3080,e73_Descriptions,,id.desc,Door Godelieve Verdoodt,descriptive note,Nederlands
a1bcc81d-03ba-52e9-9533-a83a2224fcd5,tg:lhdc:3919,e73_Descriptions,,id.desc,"Vrij naar de vertaling van H.C. Andersen voor de radio bewerkt door  
Lou Mourik",descriptive note,Nederlands
0c5ed36c-a28f-5801-887b-36fabad1a6e8,tg:lhdc:1788,e73_Descriptions,,id.desc,"Een spel van toverij door William Shakespeare. vertaald door  
Martinus Nijhoff",descriptive note,Nederlands
b0964958-8d9b-5363-8d9c-3a0e47c22dc5,tg:lhdc:3871,e73_Descriptions,,id.desc,Luisterspel voor de jeugd door Sylvain Bulcke,descriptive note,Nederlands
702cfb2c-a0f9-56bf-9550-2fcc6ef98e58,tg:lhdc:3909,e73_Descriptions,,id.desc,Luisterspel voor de kleintjes van Elisabeth T'Seyen,descriptive note,Nederlands
e50586b2-b821-5c21-8b37-48ba1310d8f5,tg:lhdc:1854,e73_Descriptions,,id.desc,"(The bun house wedding) Luisterspel door Leslie Collins, uit het  
Engels vertaald door Karel Jonckheere",descriptive note,Nederlands
f7426970-dfbe-5373-8c87-003b1797fc7c,tg:lhdc:565,e73_Descriptions,,id.desc,"Een spel van toverij door William Shakespeare  
Vertaald door Martinus Nijhoff",descriptive note,Nederlands
6ea923da-1ccc-5115-9cc1-1b56733ed722,tg:lhdc:4693,e73_Descriptions,,id.desc,Uit het leven van Hortense de Beauharnais. Luisterspel door Julia Tulkens.,descriptive note,Nederlands
4bc50a79-9182-5a04-8003-e852141ed60a,tg:lhdc:1836,e73_Descriptions,,id.desc,Luisterspel van Rhys Adrian. uit het Engels vertaald door Nora Snyers,descriptive note,Nederlands
56b79116-ead2-5c53-8d5e-6c1a3bb01c71,tg:lhdc:507,e73_Descriptions,,id.desc,"Een Deens luisterspel voor Kerstmis door Preben Thomsen  
Nederlandse vertaling: Dries Janssen",descriptive note,Nederlands
57255a84-b43d-5bb2-b2de-bae1b4c0cf4c,tg:lhdc:1826,e73_Descriptions,,id.desc,Luisterspel van Joe Orton. Uit het Engels vertaald door Andries Poppe,descriptive note,Nederlands
74c9359a-133c-58f3-9e91-19a464a02ac3,tg:lhdc:517,e73_Descriptions,,id.desc,"Luisterspel door Ermanno Maccario  
Vertaling uit het Frans door Luc ter Elst",descriptive note,Nederlands
8f5f09db-614a-59ee-acac-c9759afd67b7,tg:lhdc:2490,e73_Descriptions,,id.desc,Mini-luisterspel van Marc Minnerose,descriptive note,Nederlands
6d21388a-3138-52f1-8336-9a3caef01363,tg:lhdc:1682,e73_Descriptions,,id.desc,Zes improvisaties op een thema van Andries Poppe,descriptive note,Nederlands
c011e0c5-700d-5ada-8d47-4673b5bb83fe,tg:lhdc:2480,e73_Descriptions,,id.desc,A. Daudet,descriptive note,Nederlands
143f8eeb-4df1-566c-b640-f5a3fb33b7aa,tg:lhdc:3813,e73_Descriptions,,id.desc,"Naar het gekende sprookje van de gebroeders Grimm vrij bewerkt door  
Eddy Picavet",descriptive note,Nederlands
0bd8bdf0-d9be-58e9-a021-c44be1e39ace,tg:lhdc:1692,e73_Descriptions,,id.desc,Luisterspel van Peter Römer,descriptive note,Nederlands
a352badd-3266-50fb-87ca-2590c640bf50,tg:lhdc:3384,e73_Descriptions,,id.desc,Door Jenny Smelik-Kiggen,descriptive note,Nederlands
6d047597-2042-53a8-b4cc-381f3f156d0e,tg:lhdc:3394,e73_Descriptions,,id.desc,Door Theo Luysterburg,descriptive note,Nederlands
0492ffab-d0e7-52db-888d-53f5eb9a4d67,tg:lhdc:719,e73_Descriptions,,id.desc,Radiospel naar Multatuli door E.W. Schmidt,descriptive note,Nederlands
9cde261a-9887-5048-ab6d-5ecc25cb391f,tg:lhdc:4597,e73_Descriptions,,id.desc,Een televisie-serie geschreven door Hans Keuls,descriptive note,Nederlands
91d3baaf-961b-550e-b365-2d899fa52689,tg:lhdc:661,e73_Descriptions,,id.desc,Hoorspel naar het gelijknamig boek van Cissy van Marxveldt,descriptive note,Nederlands
e10f2075-e79f-513b-a162-3ad382ebe46d,tg:lhdc:709,e73_Descriptions,,id.desc,"Anton van Casteren 
Hoorspelwedstrijd 1950",descriptive note,Nederlands
41b0053b-3711-5f59-b374-bdd788414c91,tg:lhdc:4587,e73_Descriptions,,id.desc,Serie naar motieven van de roman van Herman Teirlinck,descriptive note,Nederlands
918e93ab-3958-5ab4-b545-99d223eae3f6,tg:lhdc:671,e73_Descriptions,,id.desc,"Door Hubert Van Herreweghen  
Naar een verhaal van Tsjekhov",descriptive note,Nederlands
12ee13f6-2250-559d-9c9d-084d84e86da8,tg:lhdc:2952,e73_Descriptions,,id.desc,Door P.H. Fruithof,descriptive note,Nederlands
327a59a3-634d-5075-be21-f5167906b343,tg:lhdc:4203,e73_Descriptions,,id.desc,Van Ben Jonson,descriptive note,Nederlands
6c2a7a45-0d7d-525c-bd59-af14351367b2,tg:lhdc:3245,e73_Descriptions,,id.desc,Door Theo Luysterburg,descriptive note,Nederlands
a751f603-fb07-587f-94a2-6a8e4eaea924,tg:lhdc:914,e73_Descriptions,,id.desc,"Deel 1   
Door Jos Janssen   
Voor de radio bewerkt door Frans Roggen",descriptive note,Nederlands
75d6f8ad-11f3-5f00-a546-0afd082c9c8b,tg:lhdc:2637,e73_Descriptions,,id.desc,Door Jan Peeters,descriptive note,Nederlands
a4f839b8-c912-557b-91e8-49e0629b7ca8,tg:lhdc:1435,e73_Descriptions,,id.desc,Luisterspel van Giles Cooper. Nederlandse vertaling: Marc Galle,descriptive note,Nederlands
ad8d7135-07c0-5a74-ac17-24ccbfc18dfa,tg:lhdc:904,e73_Descriptions,,id.desc,"Luisterspel door Germaine Dijckhoff-Ceunen.   
Bewerkt naar fragmenten uit ""Het Lied der Korenvelden"" van F. Mora",descriptive note,Nederlands
44e5102a-814c-53ba-9152-1425ea225a86,tg:lhdc:1270,e73_Descriptions,,id.desc,Door Dr. Mon De Goeyse,descriptive note,Nederlands
54d13aae-6bbd-5d10-932a-61a9803e1224,tg:lhdc:3410,e73_Descriptions,,id.desc,Door Jenny Smelik-Kiggen,descriptive note,Nederlands
a1c79d4a-ba9a-52a8-bede-de475b4c02af,tg:lhdc:2062,e73_Descriptions,,id.desc,"EEn luisterspel door Michael Hardwick. Uit het Engels vertaald door Jan  
Christiaens",descriptive note,Nederlands
7e9dc0e5-6300-574d-a49d-0eec2344724a,tg:lhdc:3568,e73_Descriptions,,id.desc,Luisterspel voor de jeugd,descriptive note,Nederlands
a586e998-335a-5678-ad86-b6883373244b,tg:lhdc:1260,e73_Descriptions,,id.desc,"Luisterspel door Harvey Unna, uit het Engels vertaald door   
G. De Rijcke",descriptive note,Nederlands
08c71f52-9a47-511d-b074-966a41b09b55,tg:lhdc:2072,e73_Descriptions,,id.desc,Luisterspel van Jan Starink,descriptive note,Nederlands
d165d341-fb64-548d-b1c5-f37d04b25cb6,tg:lhdc:3578,e73_Descriptions,,id.desc,2de prijs luisterspelwedstrijd,descriptive note,Nederlands
f8e611d2-b84f-5b0c-a9e4-55eeedf55b7d,tg:lhdc:1318,e73_Descriptions,,id.desc,Radioschets door E. Denhaene,descriptive note,Nederlands
62c249f2-b9a7-597a-ac55-22637354dd16,tg:lhdc:3776,e73_Descriptions,,id.desc,Door Jozefa Willems,descriptive note,Nederlands
73bb4b80-56e8-5e0e-b57b-a2f263b5227b,tg:lhdc:4730,e73_Descriptions,,id.desc,"Vervolgluisterspel door J.M. Devos. Naar het beroemde verhaal van Joseph  
von Eichendorff.",descriptive note,Nederlands
d852e73f-6a86-574e-8600-f55f707c48bc,tg:lhdc:1116,e73_Descriptions,,id.desc,Luisterspel door Paul Van Keymeulen,descriptive note,Nederlands
4c6e5626-33fd-5f07-a2a3-1bb3faaf9045,tg:lhdc:17,e73_Descriptions,,id.desc,"Alhambra Theatre / Theatre of Varieties / Programme for the week commencing Monday, March 9th, 1896",descriptive note,Nederlands
c8948847-fd5e-5ad9-a288-0613cc85e218,tg:lhdc:2304,e73_Descriptions,,id.desc,Luisterspel van Heinrich Goertz. vertaling Paul Vroom,descriptive note,Nederlands
30d546a7-d13e-5d43-86ba-a2eae3f8e961,tg:lhdc:4720,e73_Descriptions,,id.desc,Een luisterspel door Aster Berkhof,descriptive note,Nederlands
b30987c6-2039-5a90-956b-143ba47aa920,tg:lhdc:3766,e73_Descriptions,,id.desc,"Luisterspel geschreven door T.C. Lengyel naar een oosters sprookje.  
Uit  het Amerikaans vertaald door Andrea Petersen. Nederlandse  
bewerking: Tony Van looy",descriptive note,Nederlands
01a0b32d-d1bb-5477-b437-837a5db16f00,tg:lhdc:2314,e73_Descriptions,,id.desc,"Luisterspel van Wladyslaw Terlecki. Nederlandse vertaling: Lissete  
Stembor",descriptive note,Nederlands
27f11079-3817-56e8-848d-324b357d98fa,tg:lhdc:3123,e73_Descriptions,,id.desc,Door A.B.M. Lamboo,descriptive note,Nederlands
02605c00-af7d-5577-98cb-1a85682b5318,tg:lhdc:2429,e73_Descriptions,,id.desc,"Luisterspel door Giles Cooper. Uit het Engels vertaald door Louis  
Verbeeck",descriptive note,Nederlands
62edd05a-9706-544e-82ac-44ad17fb52ce,tg:lhdc:4165,e73_Descriptions,,id.desc,"Televisiespel van Saunders Lewis, uit het Engels vertaald door Jozef  
Coolsaet",descriptive note,Nederlands
4e90a799-5dad-5432-a8f6-9de8dc6e82bb,tg:lhdc:1743,e73_Descriptions,,id.desc,Oorspronkelijk hoorspel van J. van Randwijk en Chris Walson,descriptive note,Nederlands
9d362165-d7a3-51b6-9a22-ca11fe9e86ab,tg:lhdc:2551,e73_Descriptions,,id.desc,Een monoloog van John Halkin; vertaling: Hugo Heinen,descriptive note,Nederlands
57ef1b41-d4c2-53cb-a23b-e913bfab297d,tg:lhdc:4175,e73_Descriptions,,id.desc,Toneelspel in drie bedrijven door Arthur Miller,descriptive note,Nederlands
3b0e0eab-ba4e-59e1-bd98-0603776ffbbd,tg:lhdc:1753,e73_Descriptions,,id.desc,Uit bundel gedemonteerde stukken. Twee brieven aan Rooses.,descriptive note,Nederlands
4c75b832-1914-54fe-9441-16144ec7ea35,tg:lhdc:3133,e73_Descriptions,,id.desc,Door Theo Luysterburg,descriptive note,Nederlands
a3d1c8fb-9f3d-55e4-aba9-5148bfefae12,tg:lhdc:2439,e73_Descriptions,,id.desc,Luisterspel van Esward König,descriptive note,Nederlands
9ef4e6da-8de9-5e90-8cf9-03874e856154,tg:lhdc:2541,e73_Descriptions,,id.desc,Luisterspel van Peter Römer,descriptive note,Nederlands
aaa603ff-b4ea-5d55-80a2-bc7f00fdb589,tg:lhdc:1469,e73_Descriptions,,id.desc,"Luisterspel door John Mortimer uit het Engels vertaald door  
Christine D'Haen",descriptive note,Nederlands
0cd1f2dd-15de-5be7-9471-bee5112af8a6,tg:lhdc:820,e73_Descriptions,,id.desc,"Door Elizabeth Dawson    
Nederlandse vertaling: Erik van Ruysbeeck",descriptive note,Nederlands
71fbf8ca-0256-5cfe-a34e-0ad3297e5218,tg:lhdc:2703,e73_Descriptions,,id.desc,Door Gerda Gevers,descriptive note,Nederlands
97fab368-fa9f-5191-903c-e0838d0b87e2,tg:lhdc:3361,e73_Descriptions,,id.desc,Door Saartje Bot,descriptive note,Nederlands
219f548b-05ee-5c7a-b785-1e7ff45701b9,tg:lhdc:948,e73_Descriptions,,id.desc,Bert Leysen,descriptive note,Nederlands
6a420862-0582-52f5-b860-9e3053bb602e,tg:lhdc:4327,e73_Descriptions,,id.desc,TVspel,descriptive note,Nederlands
bb16b012-3d0f-5a2b-83bd-1008aa41d0e3,tg:lhdc:1501,e73_Descriptions,,id.desc,"Luisterspel van Ima Harube. Uit het Duits vertaald door  
J.L. De Belder",descriptive note,Nederlands
6f3542b3-b1e4-546e-b7c7-a7eb168fe8a2,tg:lhdc:3219,e73_Descriptions,,id.desc,Door Plien Pijcke,descriptive note,Nederlands
eb89783e-8bdc-568b-8bf6-c42fde2f0a90,tg:lhdc:830,e73_Descriptions,,id.desc,"Spel in vijf bedrijven, door Albrecht Rodenbach    
Voor publieke radio op werving   
Met muziek in koren van Ernest Brengier  
Bewerkt door Herman Niels  
Deel I",descriptive note,Nederlands
d766fbbc-030c-5bb7-9693-f62378347e71,tg:lhdc:1479,e73_Descriptions,,id.desc,"Luisterspel van John Kjaergaard. Nederlandse vertaling:  
Julien Van Remoortere",descriptive note,Nederlands
99225f56-6e78-5620-b13c-fe19b6bfd486,tg:lhdc:694,e73_Descriptions,,id.desc,"Radiofonisch spel in een bedrijf  
Door Lola Le Provost en Michèle-Huguette Rozenberg",descriptive note,Nederlands
dd8eda1a-e6df-5c0c-b73c-91567dd24b77,tg:lhdc:1344,e73_Descriptions,,id.desc,Door Walter Bombe,descriptive note,Nederlands
6edf8c81-4f37-5917-9d32-dd6cb931d569,tg:lhdc:3524,e73_Descriptions,,id.desc,"De ontmaskering van de valse Angelina IIIe deel  
luisterspel door Mary Manco",descriptive note,Nederlands
4845476e-3898-510d-a766-979fa9bd5986,tg:lhdc:2156,e73_Descriptions,,id.desc,Van Peter Cnops,descriptive note,Nederlands
f0ff9b49-b68a-5435-8e12-cbd093f46aa3,tg:lhdc:3534,e73_Descriptions,,id.desc,Hoorspel voor de jeugd door G.H. Peeters,descriptive note,Nederlands
7081f193-4dcf-5eff-b746-69bcfc35c157,tg:lhdc:684,e73_Descriptions,,id.desc,door Emile Lopez,descriptive note,Nederlands
eefbc102-ebe4-59f8-ad84-36206a5fa99b,tg:lhdc:2146,e73_Descriptions,,id.desc,"Auteurs: Maksim Jurjeviċ, Hrvoje Hegedusiċ, Vito Gospodnetic",descriptive note,Nederlands
2d300ff5-dfab-59af-beb9-8d00ea4ae107,tg:lhdc:2348,e73_Descriptions,,id.desc,Door Witold Zadrowski. Nederlandse vertaling: Jan van den Weghe,descriptive note,Nederlands
661780a0-6710-5f7a-85eb-c97e170ce772,tg:lhdc:3642,e73_Descriptions,,id.desc,Tweede deel,descriptive note,Nederlands
448cfd2d-9aa9-5c57-860b-db7833f770e8,tg:lhdc:1022,e73_Descriptions,,id.desc,voor de radio bewerkt door Maria Verheyen,descriptive note,Nederlands
c54082a7-7fcb-59cf-be2d-afae8df6fd87,tg:lhdc:4604,e73_Descriptions,,id.desc,Deel 6,descriptive note,Nederlands
76f339aa-e986-5227-95ea-6a1b1b9afa6f,tg:lhdc:1032,e73_Descriptions,,id.desc,"Een luisterspel door Hugh Stewart, naar het gelijknamige toneelstuk  
van Sir James Barrie, en uit het Engels   vertaald door Georgete De Rijcke",descriptive note,Nederlands
fb9a1be8-d336-5feb-955f-195454085183,tg:lhdc:3652,e73_Descriptions,,id.desc,Luisterspel voor de jeugd,descriptive note,Nederlands
204447ad-61e5-550e-a1d0-cc4bfbddea96,tg:lhdc:2220,e73_Descriptions,,id.desc,Een luisterspel van David Marshall,descriptive note,Nederlands
76d89bcd-1644-5a3a-80eb-604fbaa0f032,tg:lhdc:1677,e73_Descriptions,,id.desc,"Luisterspel van Zbigniew Herbert, uit het Pools vertaald door Mon Detrez",descriptive note,Nederlands
319fdbe8-5a9d-5711-8af6-6ae221aa7439,tg:lhdc:4051,e73_Descriptions,,id.desc,Televisiespel van Elie-Goerges Berreby,descriptive note,Nederlands
1ef233af-5386-5ced-9aeb-0b3dedec5a41,tg:lhdc:2465,e73_Descriptions,,id.desc,Luisterspel van Roderick Wilkinson,descriptive note,Nederlands
2cc020a1-466c-52f3-acaf-65b753b4550b,tg:lhdc:4129,e73_Descriptions,,id.desc,Door Harold Pinter,descriptive note,Nederlands
4b53d575-8f11-5cc7-85a0-fe175ceaf4f4,tg:lhdc:1667,e73_Descriptions,,id.desc,"Luisterspel door Giles Cooper. Uit het Engels vertaald door  
Erik Van Ruysbeek",descriptive note,Nederlands
945cbe25-23ea-5287-ade5-cc1127ab9593,tg:lhdc:4041,e73_Descriptions,,id.desc,Televisiespel van Herman Heijermans,descriptive note,Nederlands
692235c2-8757-545f-a6af-bd5a04ac830a,tg:lhdc:4139,e73_Descriptions,,id.desc,Een spel van Odon Von Horvath,descriptive note,Nederlands
7aa55514-26c4-5f87-ba9d-b67243a7ad34,tg:lhdc:2475,e73_Descriptions,,id.desc,Mini-luisterspel van Herman Van Winsen,descriptive note,Nederlands
4b70c056-84b6-5579-b83f-34663d070191,tg:lhdc:3783,e73_Descriptions,,id.desc,Luisterspel voor de jeugd door Joost Kortenaer,descriptive note,Nederlands
5498a787-9ae2-53c9-ad55-64111965c35f,tg:lhdc:2289,e73_Descriptions,,id.desc,Een stemmenmobiel van Gerrit Pleiter,descriptive note,Nederlands
fe3aa4a2-4f6f-5ad4-9c0f-8292db3e228b,tg:lhdc:1912,e73_Descriptions,,id.desc,"Een hoorspel naar een deel uit ""Entweder - Oder"" van Sören Kierkegaard  
door Max Gundermann. vertaling: Hubert Lampo",descriptive note,Nederlands
bf2bdcc2-82c8-522b-9982-39bf619632a4,tg:lhdc:3793,e73_Descriptions,,id.desc,Oorspronkelijk luisterspel door Herman Rosseau en Jef Pirreault,descriptive note,Nederlands
e5cf90bd-40b2-5ccf-8af7-ffa5c36096e5,tg:lhdc:2299,e73_Descriptions,,id.desc,"Een luisterspel van Rainer Puchert. Nederlandse bewerking:  
Adriaan Ceelen",descriptive note,Nederlands
275bc447-4997-5ec0-9e5d-b8008c650e1b,tg:lhdc:3937,e73_Descriptions,,id.desc,Luisterspel voor de jeugd door Mary manco,descriptive note,Nederlands
4ee99a3f-db09-5a47-8c0f-5d8ecff09316,tg:lhdc:4190,e73_Descriptions,,id.desc,Door Bertolt Brecht,descriptive note,Nederlands
f703da9d-12f4-5bfa-ac9f-1b0db243eca4,tg:lhdc:3927,e73_Descriptions,,id.desc,"Gelegenheidsluisterspel voor de Jeugd, n.a.v. de schooldag over  
alcohol-en drugproblemen geschreven door E. Ryckaerts",descriptive note,Nederlands
bcb13d61-2742-5573-86d8-60f386c2610e,tg:lhdc:4180,e73_Descriptions,,id.desc,Door Paul Lebeau. TV bewerking: Walter Merhottein,descriptive note,Nederlands
47a2d79e-24dc-5e46-b4b5-0bbc403eb0dc,tg:lhdc:899,e73_Descriptions,,id.desc,"Een drama van Leo Tolstoi    
tot luisterspel bewerkt door Peter Flamm   
Uit het Duitsch vertaald door Marcel Coole",descriptive note,Nederlands
5554b98a-95db-5de8-ac85-3e96c43392e3,tg:lhdc:110,e73_Descriptions,,id.desc,"Aanbevelingsverslag over August van Cauwelaert om hem tot ""officier auxiliaire"" (hulpofficier) in het Belgische Leger te benoemen.",descriptive note,Nederlands
267ab1ad-1c8a-55e1-91b3-48ddac4e267a,tg:lhdc:889,e73_Descriptions,,id.desc,Bewerkt uit het Engels door Gerrit Kreveld,descriptive note,Nederlands
c15032ef-2d5b-54f1-bddd-1c687052396b,tg:lhdc:2097,e73_Descriptions,,id.desc,"Luisterspel van Maggie Ross. Uit het Engels vertaald door Germaine  
Blondeau",descriptive note,Nederlands
7379f785-bdb7-5105-bd7e-1ac7fa5ad099,tg:lhdc:755,e73_Descriptions,,id.desc,Luisterspel door Theo Huet,descriptive note,Nederlands
1effe3b0-1f28-5d22-9524-a87ded92b25b,tg:lhdc:1285,e73_Descriptions,,id.desc,Door Bas Van Deilen,descriptive note,Nederlands
648f786f-b838-5680-80df-fb65c39324a7,tg:lhdc:745,e73_Descriptions,,id.desc,Door A. Thiry,descriptive note,Nederlands
8686840e-5aea-5d31-92c0-4e3b7521e03a,tg:lhdc:1295,e73_Descriptions,,id.desc,radioschets door gerard Walschap,descriptive note,Nederlands
9e8d068c-3a7a-590d-b0ca-b4652b560216,tg:lhdc:2814,e73_Descriptions,,id.desc,Door André Wieme,descriptive note,Nederlands
0aa06ffa-1271-5700-a743-cc2781ab2dfd,tg:lhdc:737,e73_Descriptions,,id.desc,Naar Breughel de oude,descriptive note,Nederlands
6937e5ad-3e68-5f5c-9c1e-82ce46706c50,tg:lhdc:3497,e73_Descriptions,,id.desc,Een Deeense saga,descriptive note,Nederlands
17025334-7851-5c27-8785-6106b6d5c489,tg:lhdc:727,e73_Descriptions,,id.desc,"Een episode uit het leven van Victor Hugo,
vrij bewerkt naar historische gegevens door René Renquin en Fred van Hall",descriptive note,Nederlands
6ec30392-6a66-5d31-a6f6-673e0dfb8b65,tg:lhdc:162,e73_Descriptions,,id.desc,"'Diploma', Seizoen 1918-1919 (Plantage-Schouwburg)",descriptive note,Nederlands
db6747fb-2780-5a2a-921c-f1a847e80530,tg:lhdc:4294,e73_Descriptions,,id.desc,Door Siegfried Lenz,descriptive note,Nederlands
362a2ce4-dc86-5db9-b0d4-e45d4da9e566,tg:lhdc:993,e73_Descriptions,,id.desc,Keizer Jones door Eugene O'Neill,descriptive note,Nederlands
5ab69eec-b681-585c-afed-20088de2f087,tg:lhdc:172,e73_Descriptions,,id.desc,Artikel verschenen in 'De Nieuwe Standaard',descriptive note,Nederlands
64561ea8-d0dd-52e6-b6a5-77c666daed11,tg:lhdc:4284,e73_Descriptions,,id.desc,"Toneelspel in drie bedrijven door Luigi Squarzina. Vertaling: Manuel  
Straub",descriptive note,Nederlands
7dfb3e92-5c2c-5428-befd-ca20cde14869,tg:lhdc:3955,e73_Descriptions,,id.desc,Oorspronkelijk luisterspel voor de Jeugd geschreven door Ben Loog,descriptive note,Nederlands
1c80804b-dee8-540a-91b3-a87572848a45,tg:lhdc:3699,e73_Descriptions,,id.desc,Oorspronkelijk luisterspel voor kinderen door Lou Mourik,descriptive note,Nederlands
5414d5ce-b3a5-5c81-b48d-fdde9af23498,tg:lhdc:80,e73_Descriptions,,id.desc,Programma voor het Alhambra in Londen,descriptive note,Nederlands
67635181-ec50-5c08-9869-659043aea3fc,tg:lhdc:2393,e73_Descriptions,,id.desc,Een luisterspel van Fernand Handpoorter,descriptive note,Nederlands
3abec121-2ddd-5ce4-82c6-2ec61aa5089a,tg:lhdc:1818,e73_Descriptions,,id.desc,"Een Nigeriaans luisterspel van Wole Soyinka. In een Nederlandse vertaaling  
van Jeroen Brouwers",descriptive note,Nederlands
d141c7ed-191d-5cd2-9bdb-4b745e414ba4,tg:lhdc:1181,e73_Descriptions,,id.desc,Een luisterspel van Marcel Picard vertaald door Hubert Van Herrewghen,descriptive note,Nederlands
489c0130-51f9-520a-9d6d-d4da29d4769a,tg:lhdc:539,e73_Descriptions,,id.desc,Luisterspel van Rhys Adrian,descriptive note,Nederlands
950593d6-974c-5beb-9fd6-d59d15ec81bc,tg:lhdc:3689,e73_Descriptions,,id.desc,Luisterspelletje door Christine Guirlande,descriptive note,Nederlands
5ee39737-38c6-537a-ba3d-82f8e507dae5,tg:lhdc:2383,e73_Descriptions,,id.desc,Een luisterspel door Christopher Russel,descriptive note,Nederlands
0090a3c0-a2ae-5ce4-a6d8-c37d8544f94a,tg:lhdc:1970,e73_Descriptions,,id.desc,"Een interludium voor radio door Dan Treston.  
Nederlandse vertaling: Germaine Blondeau",descriptive note,Nederlands
f70b16a2-7e69-506b-9fa7-de5dd829bb8d,tg:lhdc:90,e73_Descriptions,,id.desc,"Monsieur Léon Volterra présente  
*Girls sans Uniforme* 
revue de Ed. Bodart et Marcel Roels",descriptive note,Nederlands
d5f2d767-5b1a-5006-ba11-065484d2a368,tg:lhdc:1191,e73_Descriptions,,id.desc,Luisterspel door Lea Rubber,descriptive note,Nederlands
ebaf5f80-8d52-50f3-b5e1-c72130d57eaf,tg:lhdc:1808,e73_Descriptions,,id.desc,"Luisterspel van Norman Edwards, uit het Engels vertaald door Piet Van Aken",descriptive note,Nederlands
b8a9e416-1023-5912-8be3-61e4a7db12a4,tg:lhdc:4033,e73_Descriptions,,id.desc,Programma: Antoon Carette,descriptive note,Nederlands
b7b649bf-96aa-5b5d-aee3-bab0286246ef,tg:lhdc:3894,e73_Descriptions,,id.desc,Gevariëerd luisterspel,descriptive note,Nederlands
0d7d058a-4157-5776-8dad-eac036e6e0a7,tg:lhdc:3065,e73_Descriptions,,id.desc,Door J. Vlinder,descriptive note,Nederlands
08d40d9d-92cb-55e4-8cbd-5b428c42d6a0,tg:lhdc:4023,e73_Descriptions,,id.desc,Nederlandse vertaling van Johan Boonen,descriptive note,Nederlands
f7fa6c20-a18a-5ef3-ab6a-8c0a1705b527,tg:lhdc:2417,e73_Descriptions,,id.desc,Luisterspel van Istvàn Csurka,descriptive note,Nederlands
6dda223c-95ee-5ceb-b191-cdcbc6b98cb3,tg:lhdc:3884,e73_Descriptions,,id.desc,Luisterspel voor de jeugd over de alcohol- en andere drugproblemen,descriptive note,Nederlands
8be95268-f8da-5072-95d9-8b58a30c2f42,tg:lhdc:1040,e73_Descriptions,,id.desc,"Een luisterspel door Friedrich Feld  
uit het Duits vertaald door Georgette De Rijcke",descriptive note,Nederlands
9373ed4b-9d1a-5f48-922b-09922f2429fc,tg:lhdc:590,e73_Descriptions,,id.desc,"Een humoreske voor radio door Alan Sharp  
Uit het Engels vertaald door Germaine Blondeau",descriptive note,Nederlands
29bb89e8-40c7-5f56-8efd-89d5959a11c4,tg:lhdc:4666,e73_Descriptions,,id.desc,Luisterspel in zes delen door Jenny Smelik-Kiggen,descriptive note,Nederlands
1046ad95-9224-5d5a-92a9-5e0764d3f19b,tg:lhdc:39,e73_Descriptions,,id.desc,Programma van het Parijse theater La Bodinière voor het seizoen 1895-1896,descriptive note,Nederlands
473d2ec3-4916-50ae-8151-8d4ebaea3377,tg:lhdc:3620,e73_Descriptions,,id.desc,2de deel luisterspel voor de jeugd door Mary Manco,descriptive note,Nederlands
179d3a47-9fcf-55e6-98b3-0243c6fc8005,tg:lhdc:1138,e73_Descriptions,,id.desc,Luisterspel door Ernst Johannsen,descriptive note,Nederlands
cd9d35a9-883d-5037-b4b1-6629b5190ee9,tg:lhdc:2252,e73_Descriptions,,id.desc,"Uit bundel gedemonteerde stukken. Doc. Platen/prenten van Jordaens voor de catalogus. Bevat ook een submapje: ""Teekeningen Onze Kunst"". Geannoteerd door Rooses.",descriptive note,Nederlands
573f24cc-a176-567c-97ad-a8384e32a811,tg:lhdc:3758,e73_Descriptions,,id.desc,"Luisterspel in twee delen; (naar het gelijknamige jeugdboek en   
toneelstuk van deze auteur) uit Duit vertaald door Karel Ruyssinck",descriptive note,Nederlands
ada6eb96-3fac-5442-a796-887e1bd638ad,tg:lhdc:3630,e73_Descriptions,,id.desc,Hoorspel voor de jeugd,descriptive note,Nederlands
2fd995ea-096c-5220-8d3f-c242d67419bb,tg:lhdc:1050,e73_Descriptions,,id.desc,"Mysterispel van vijf bedrijven, door Gabriele d' Annunzio  
Muziek van Claude Debussy, Nederlandse versie door Anton Van De Velde",descriptive note,Nederlands
9146f81d-128d-55a3-8dbf-ca15397aa63c,tg:lhdc:580,e73_Descriptions,,id.desc,Luisterspel van Saul Bellow,descriptive note,Nederlands
a02b6943-8df7-5e97-90c1-7afeac5de211,tg:lhdc:4676,e73_Descriptions,,id.desc,Hoorspel door Paula Van Loock,descriptive note,Nederlands
6ed628f6-6596-514f-900f-a05da2295720,tg:lhdc:2242,e73_Descriptions,,id.desc,Een luisterspel van Patrick Bernauw,descriptive note,Nederlands
d84e2832-bdea-5ebe-a5c8-d92e3dbfc7ab,tg:lhdc:3748,e73_Descriptions,,id.desc,Luisterspel voor de jeugd,descriptive note,Nederlands
2c6b4f9a-5895-58ed-942d-0199796646e6,tg:lhdc:1128,e73_Descriptions,,id.desc,Er is vader en vader (Markurells i Wadköping,descriptive note,Nederlands
ba5a8650-c579-5927-85d6-3fc59091992e,tg:lhdc:3546,e73_Descriptions,,id.desc,Door Friedrich Feld. Nederlandse vertaling: R. Van Leuven,descriptive note,Nederlands
b66be7da-ac2d-5ac0-86a8-315627dffdb9,tg:lhdc:4500,e73_Descriptions,,id.desc,Achtste aflevering,descriptive note,Nederlands
c8e045c0-bee4-52f8-8e7b-f9490540a2cf,tg:lhdc:2134,e73_Descriptions,,id.desc,Van Jiri Klobouk,descriptive note,Nederlands
812f1167-6cba-579e-a6f0-0f27b7f2c40a,tg:lhdc:4478,e73_Descriptions,,id.desc,Aflevering 23,descriptive note,Nederlands
1a22de9e-9f29-5628-a331-901ce1e76956,tg:lhdc:1336,e73_Descriptions,,id.desc,Door Max DÜrr,descriptive note,Nederlands
33cbce3d-33e7-5e91-9e97-d4f8ef65ddf0,tg:lhdc:3556,e73_Descriptions,,id.desc,Luisterspel voor de jeugd,descriptive note,Nederlands
8af55a94-9fb9-51da-92eb-81eff216ea4f,tg:lhdc:2124,e73_Descriptions,,id.desc,Luisterspel door Dieter Kuhn. Uit het Duits vertaald door Louis Povel,descriptive note,Nederlands
26c5fb2a-1429-54d9-936b-83a75c66087d,tg:lhdc:3313,e73_Descriptions,,id.desc,Door Albert Boven,descriptive note,Nederlands
f07136fb-944e-5fcb-befa-363d4a870c48,tg:lhdc:2619,e73_Descriptions,,id.desc,Auteur: Jules Laforgue. vertaling en bewerking: Alex Wilequet,descriptive note,Nederlands
de86abfc-f66f-5fb0-ab07-49c0d4c33b73,tg:lhdc:1573,e73_Descriptions,,id.desc,Door Lydia Ragosin. Vertaling: Renè Verbeeck,descriptive note,Nederlands
141129c4-b535-53d5-b060-1536afcc9454,tg:lhdc:842,e73_Descriptions,,id.desc,"Door P.O. Gilbert   
Vertaald door Frits van Tichelen
5e episode",descriptive note,Nederlands
b4cf1021-28b2-58f0-91d3-af2c705fe44e,tg:lhdc:2761,e73_Descriptions,,id.desc,Door R. Metzemaeker,descriptive note,Nederlands
ebb68e91-2e5e-5986-9524-c19022afbb6b,tg:lhdc:2771,e73_Descriptions,,id.desc,Door Lucas Josse,descriptive note,Nederlands
ae6bc9b8-c2b2-5b22-917f-ad2756be6da8,tg:lhdc:852,e73_Descriptions,,id.desc,Bedrijf door H. Opdebeeck,descriptive note,Nederlands
3ff3ad76-0d32-5bf7-9be7-9d8f3577c1de,tg:lhdc:1587,e73_Descriptions,,id.desc,Door Viktor Sordan,descriptive note,Nederlands
