ResourceID,brocade.id,card,order,note,Annotation,Annotation Type,Annotation Language
cf68fc39-4ade-58d9-a61e-4dd2a5d7512e,tg:rubdoc:4230,Annotations,1,note.rubalg,"Sainsbury (1825 - 1895) was archivaris bij het Public Record Office in Londen. Hij publiceerde in 1859 de *Original unpublished papers illustrative of the life of Sir Peter Paul Rubens, as an artist and a diplomatist, preserved in H.M. State Paper Office*. Zie ook: https://www.royalacademy.org.uk/art-artists/name/william-noel-sainsbury.  
  
Verder bevat de band:  
  
* Een los stuk van [Frans Jos van den Branden](https://anet.be/record/isaarrub/au::2751/N) over Albert Rubens.  
* Een enveloppe met opschrift """"Max Rooses Handschrift"""" met daarin een notitieschriftje van Rooses. De eerste pagina begint met hoofding """"Carpentras / Lettres de Peiresc à Rubens"""". De pagina's zijn genummerd van 1 t.e.m. 23 maar enkel de oneven pagina's zijn beschreven. Op elke pagina staat in potlood de opmerking """"revu"""".
* Een omslag met opschrift """"Collection Sainsbury"""". Bevat notities en transcripties, voornamelijk in andere handschriften dan dat van Rooses (maar mogelijk wel aan hem toegezonden en door hem geannoteerd). Er zit een brief tussen die dateert van 1899.
* Acht omslagen zonder opschrift met krantenknipsels die ooit in het Rubenianum op papieren fiches gekleefd werden en voorzien van de getypte hoofding """"Doc. Rooses / Extraits de journaux appartenant à Mr. Noel Sainsbury / 18-X-1894"""". De opgekleefde stukken dateren wel niet allemaal uit 1894: als er data vermeld staan is dit vooral uit de jaren 70 en 80 van de 19de eeuw. 
Tussen de knipsels zitten ook andere stukken: twee brieven uit 1888 van Roper Lethbridge aan Noël Sainsbury en een document, over twee inscripties over de familie Rubens in Antwerpse kerken, dat overhandigd werd aan Sainsbury in 1861.
* Een originele omslag met opschrift """"Afschriften van brieven van Rubens"""". Bevat transcripties (zowel door Rooses als door andere handen), notities (o.a. """"Paris / Documents sur Rubens à la Bibliothèque nationale"""", stukken vermoedelijk aan Rooses toegestuurd), briefwisseling aan Rooses (daterende van 07/04/1882 (afzender: verzamelaar uit Rome), 18/07/1892, 23/11/1896 (afzender: Léon Brunschvig) 12/02/1898), excerpten uit literatuur (o.a. van artikel *Lettres inédites de Rubens* door Charles Simond uit 1898). 
* Een originele omslag met opschrift """"Ventes d'autographes"""". Bevat notities, excerpten en briefwisseling (24/03/1894) van Rooses i.v.m. geveilde brieven, grotendeels van bij Charavay in Parijs maar bijvoorbeeld ook Sotheby's in Londen. 
* Een omslag zonder opschrift. Bevat transcripties van brieven van Jacob Jordaens, waarvan eentje overgenomen uit Oud Holland 1891.
* Een omslag zonder opschrift. Bevat transcripties van brieven van [Godfried Wendelen](https://anet.be/record/isaarrub/au::21192/N) (Govaert Wendelen). 
* Een omslag zonder opschrift. Bevat notities (een gedateerd 11/04/1899) omtrent 19de-eeuwse veilingen van brieven en overzichten van brieven in bepaalde collecties alsook transcripties. Verder ook briefwisseling: brief van burgemeester [Jan van Rijswijck](https://anet.be/record/isaarrub/au::15746/N) aan Rooses i.v.m. Codex Diplomaticus Rubenianus (28/05/1894), brieven van Roper Lethbridge aan Noël Sainsbury (24/09/1888 en 7/12/1888). Ten slotte ook twee opvragingsbiljetten van een Engelstalige instelling uit 1888 getekend door Ch. Ruelens. 
* Een omslag zonder opschrift. Bevat notities (Rooses en andere handen), overzichten, transcripties en briefwisseling (08/09/1893 (afzender: Em. Spanagh) en 08/09/1875[?]). Een gedeelte handelt over familie (Isabella) Brant. Op het laatste document staat """"Notes Ruelens"""", wat erop zou kunnen wijzen dat dit door hem geschreven was en dat we datzelfde handschrift in de volledige band dus als het zijne kunnen identificeren. 
* Zes losse stukken van eenzelfde hand, niet Rooses. Werd deels geschreven op achterzijde van een document dat ten vroegste dateert van 1938, dus latere toevoeging in het archief.",Algemeen,Nederlands
cf68fc39-4ade-58d9-a61e-4dd2a5d7512e,tg:rubdoc:4230,Annotations,2,note.rubalg,"De documenten werden in het Rubenianum ooit (grotendeels) herordend in thematische submapjes (vermoedelijk door Paul Huvenne, die op het eerste submapje """"Collection Sainsbury"""" schreef). Er werd ook minstens één stuk aan toegevoegd dat niet origineel tot het pakket behoorde.  
  
De band stond in het Rubenianum lange tijd bij het archief van Ludwig Burchard (en kreeg dan ook nr. 38 in de plaatsingslijst van deze collectie). 

",Algemeen,
0468028f-0e57-5480-abf3-ce05942f43c3,tg:rubdoc:4226,Annotations,1,note.rubalg,"After finding our archival description online, Evers' youngest son, Karsten Evers, contacted the Rubenianum in 2019. He had found this folder in a box with material of H. G. Evers that came to Karsten Evers after it was nearly thrown away at the Bildarchiv Marburg. He subsequently donated the folder to the Rubenianum.",Algemeen,Nederlands
2d9cada7-03ca-5273-bdb5-59108dc587b9,tg:rubdoc:4180,Annotations,1,note.rubalg,"They probably were used for the Rubens calendar (see Kiste 2, Lose Akte 25).",Algemeen,Nederlands
2e120e9e-2e7d-5f64-acf2-d9be5b45121b,tg:rubdoc:4227,Annotations,1,note.rubalg,"Dit dossier werd in het Rubenianum tot eind 2017 bewaard in de dozen *Aanbiedingen Schilderijen* (bij het adviezenarchief) als dossier """"1909/1"""". Vermoedelijk kwam het daar terecht in 1982 (af te leiden van het etiket dat erop werd gekleefd). Op het eerste stuk werd ook door een toenmalige medewerker van het Rubenianum (Paul Huvenne) de inhoud geduid. De documenten dragen geen """"Doc.Rooses""""-stempel, maar dit werd in potlood wel op datzelfde eerste stuk geschreven.",Algemeen,Nederlands
c0f66260-fce1-55bf-ad1b-99b269cd9afd,tg:rubdoc:4231,Annotations,1,note.rubalg,Vermoedelijk zaten de stukken oorspronkelijk in de grotere band rond hetzelfde onderwerp (RA 006 / 004) maar werden ze er in het Rubenianum ooit uitgehaald en niet teruggestoken.,Algemeen,Nederlands
941f9a7d-4d69-50ed-9754-4a523aa02c60,tg:rubdoc:4328,Annotations,1,note.rubalg,"Omvat:  
  
- Brief van Buschmann, vermoedelijk aan Rooses, d.d. 12/11/1901, o.a. betreffende Onze Kunst en Van Eyck.  
- Drukwerk van Duitse Uitgeverij, met in potlood opschrift """"Varia"""". Diende als omslag maar is nu leeg.  
- Drukwerk van Museum Plantin-Moretus met in potlood opschrift """"Varia II"""". Dient als omslag voor nummer van Duits tijdschrift """"Daheim"""". De pagina's met het artikel over Rubens werden eruit gehaald en zitten in RA 006 / 015.  
- Krantenknipsel over Rubens uit Le Matin 27/01/1897.  
- Excerpt uit literatuur, gedicht 'Rubens Borstbeeld' uit """"Dicht en Tooneelkundig Nalatenschap"""" van J. F. Willems (1856). Geannoteerd maar niet door Rooses.  
- Excerpt uit literatuur, Franse tekst over Rubens' beeld.  
- Reeks facturen voor gravuren naar Rubens, aangekocht door ene Lady Carington van ene G.   Love[?], 1854-1857. Gemonteerd op pagina's uit een Brits tijdschrift. Gezien Rooses contacten had met bv. Sainsbury en erg geïnteresseerd was in dit soort gravures, mogelijk afkomstig uit zijn archief. Frans Baudouin voegde de nota """"class. in de Rubens' Bible"""" bij de stukken.   

Het is niet van alle stukken 100% zeker dat ze uit het archief van Rooses afkomstig zijn. De stukken werden in mei 2021 teruggevonden in de doos met algemene biografische stukken over Rubens bij de Rubensdocumentatie van het Rubenianum. In de dozen met verzameling losse stukken m.b.t. documenten over Rubens bij de Rubensdocumentatie van het Rubenianum, zit in map 234 vooraan overigens één transcriptie die 19de-eeuws oogt en mogelijk ook uit het archief van Rooses afkomstig is.",Algemeen,Nederlands
002257b6-844f-5e14-843f-bf067ce040a1,tg:rubdoc:4236,Annotations,1,note.rubalg,"Etiket op rug: """"Exposition / L'Art Belge au XVIIe siècle / 1910"""".  

Bevat inkomende briefwisseling uit de periode van 14/05/1909 tot en met 2/01/1911 ter voorbereiding en eveneens ter afhandeling van de tentoonstelling, gericht aan Rooses (heel wat brieven afkomstig van [Paul Lambotte]( https://anet.be/record/isaarrub/au::10919/N), algemeen secretaris van de commissie). 

De brieven zijn (grotendeels) chronologisch geordend en handelen onder meer over het programma van de tentoonstelling en de bruiklenen.  

Bevat verder ook drukwerk in verband met de tentoonstelling, lijstjes van kunstwerken, rekeningen, telegrammen, krantenknipsels, een postkaart, een foto van een kunstwerk, een conditierapport van enkele werken, een uittreksel van een proces-verbaal van het college van burgemeester en schepenen van de Stad Antwerpen en een uitnodiging aan Rooses voor het *Congrès International d'Art et d'Histoire* (augustus 1910).  

Achteraan bevinden zich los toegevoegde documenten zoals een hele reeks kladjes van uitgaande brieven van Rooses (deels genummerd), notities van Rooses (e.a.), een rekening, twee brieven aan Rooses en een excerpt uit literatuur.  
",Algemeen,Nederlands
002257b6-844f-5e14-843f-bf067ce040a1,tg:rubdoc:4236,Annotations,2,note.rubalg,"De bundel van oorspronkelijk 10 (waarvan slechts 7 beschreven) katernen werd wegens conservatorische overwegingen gedemonteerd en de stukken worden nu in individuele mapjes bewaard, apart van de kaft.",Algemeen,
002257b6-844f-5e14-843f-bf067ce040a1,tg:rubdoc:4236,Annotations,3,note.rubalg,Opmerking: deze bundel bevatte tijdens de inventarisatie twee losse documenten (een gedrukte rondzendbrief door Rooses geannoteerd en een geschreven brief daterende 19/05/1905; map 32 en 33) die te maken hebben met de Jordaenstentoonstelling van 1905 en terug werden verplaatst naar hun rechtmatige plaats (zijnde: RA 006 / 006).,Algemeen,
e143e02a-6049-5504-b0c2-ed597bc2b920,tg:rubdoc:3989,Annotations,1,note.rubalg,Contains three photographs of the restauration of the Rubenshouse.,Algemeen,Nederlands
0a42d3d4-1adb-5580-af78-935351735045,tg:rubdoc:4329,Annotations,1,note.rubalg,"De stukken werden teruggevonden in de Rubenianumdocumentatie over het Rubenshuis (materiaal Frans Baudouin-Nora De Poorter). Gezien verschillende stukken annotaties van Rooses bevatten en gezien de datering, zijn ze vermoedelijk allemaal afkomstig uit het archief van Rooses. Doorheen de jaren werden ze in het Rubenianum wel in een niet originele map en allerlei submappen gestoken.",Algemeen,Nederlands
b5b4092b-9eac-5dfb-b3ae-60d8539a47e6,tg:rubdoc:3969,Annotations,1,note.rubalg,"One document bears Evers' signature and stamp (""""Prof. Fr. Hans Gerhard Evers 6101 Traisa bei Darmstadt Heldeweg 2 . Tel. 06151/14308"""")",Algemeen,Nederlands
ad2cf02e-44e1-5a12-9a6c-745d34f3ed55,tg:rubdoc:4131,Annotations,1,note.rubalg,Contains a card with a (passport) photograph of Evers.,Algemeen,Nederlands
e65f865f-587d-53f2-addb-f83fa0a9ed03,tg:rubdoc:4234,Annotations,1,note.rubalg,"Etiket op rug: """"Tentoonstelling Jordaens / Duitschland / Denemarken / Italië / Frankrijk / Zweden / Rusland / Canada"""".  

Bevat inkomende briefwisseling uit de periode van januari tot en met november 1905 ter voorbereiding en eveneens ter afhandeling van de tentoonstelling (bv. bruiklenen en transport ervan), voornamelijk gericht aan Rooses maar ook aan de burgemeester van Antwerpen.  

De briefwisseling is geordend per land (telkens afgebakend met een tussenblad en tabblad) en vervolgens chronologisch op datum. Het grootste deel is afkomstig uit Duitsland; Canada bevat overigens enkel een visitekaartje. Er zit (minstens) een brief tussen die eigenlijk gedateerd is in 1904 maar werd ingewerkt alsof hij uit 1905 dateert.  

Bevat verder ook losse notities, foto's van kunstwerken, visitekaartjes, postkaarten, een telegram, een gedrukte brochure van de Duitse spoorwegen en een excerpt uit een collectiecatalogus.  

Vooraan bevinden zich een (later toegevoegd) Nederlandstalig en Franstalig exemplaar van de catalogus *Tentoonstelling van prenten naar het werk van Pieter Bruegel den Oude* (Museum Plantin-Moretus, 6 p.) uit 1924.",Algemeen,Nederlands
e65f865f-587d-53f2-addb-f83fa0a9ed03,tg:rubdoc:4234,Annotations,2,note.rubalg,"De bundel van oorspronkelijk 10 katernen werd wegens conservatorische overwegingen gedemonteerd en de stukken worden nu in individuele mapjes bewaard, apart van de kaft.",Algemeen,
ab19efae-57d2-5245-9c83-c6a0af9d167b,tg:rubdoc:4262,Annotations,1,note.rubalg,De grotere map rond dit onderwerp in de Rubensdocumentatie bevat ook een overdruk uit de bibliotheek van Burchard (nr. 8111) met een opdracht aan Rooses d.d. 15/02/1903. Dit stuk behoorde vermoedelijk dus ook ooit tot de bibliotheek van Rooses. Het gaat om het artikel 'Rubens' eigenhändiges Original der heiligen Familie in Antwerpen (La vierge au perroquet)' van Eugen Voss. Zie link onderaan.,Algemeen,Nederlands
bbd86a70-370b-5266-842f-1b6c14e7c06a,tg:rubdoc:4235,Annotations,1,note.rubalg,"Etiket op rug: """"[T]entoonstelling Jordaens / Engeland / Holland / Oostenrijk Hongarije"""".
  
Bevat inkomende briefwisseling uit de periode van september 1904 tot en met december 1905 ter voorbereiding en eveneens ter afhandeling van de tentoonstelling, voornamelijk gericht aan Rooses maar ook aan de burgemeester van Antwerpen. 

Drie brieven werden los toegevoegd: een van 26/12/1905, een van 18/3/1906 en een van 2/04/1906. Dit los toevoegen van iets jongere documenten doet vermoeden dat het inbinden reeds in 1905 zelf gebeurde.  

De briefwisseling is geordend per land (telkens afgebakend met een tussenblad en tabblad) en vervolgens chronologisch op datum.  

Bevat verder ook visitekaartjes, postkaarten, foto's van kunstwerken, een telegram, een krantenknipsel, een reproductieprent uit publicatie geknipt en een gedrukt document met een overzicht van de leden van de *Commission autrichienne pour l'exposition universelle de Liége en 1905*.",Algemeen,Nederlands
bbd86a70-370b-5266-842f-1b6c14e7c06a,tg:rubdoc:4235,Annotations,2,note.rubalg,"De bundel van oorspronkelijk 10 (waarvan slechts 8 beschreven) katernen werd wegens conservatorische overwegingen gedemonteerd en de stukken worden nu in individuele mapjes bewaard, apart van de kaft.",Algemeen,
dd2868d5-af0b-5e92-b4dd-2e0058b607bb,tg:rubdoc:4219,Annotations,1,note.rubalg,Possibly connected to RA 010 / 278.,Algemeen,Nederlands
643a56ab-ada8-5856-bc6f-6d6b4c7e4a1c,tg:rubdoc:4232,Annotations,1,note.rubalg,Deze documenten werden ooit terug uit de Rubensdocumentatie van het Rubenianum gehaald of werden er nooit in ingeklasseerd. Deze stukken worden daarom nu los bij het archief van Rooses bewaard.,Algemeen,Nederlands
f1d50cee-780f-5c69-ac0a-55b4d95427f3,tg:rubdoc:4183,Annotations,1,note.rubalg,"There are other photos of necklaces in RA 010 / 054, RA 010 / 185 and RA 010 / 193.",Algemeen,Nederlands
14db1bde-a748-5dc9-b232-2c4baf24762d,tg:rubdoc:4228,Annotations,1,note.rubalg,"Rooses schreef in potlood bovenaan de brieven het onderwerp van het werk van Rubens waarover ze handelen. De brieven zijn geordend op dit onderwerp.
    
Etiket op rug: """"Oeuvre de Rubens 1885 / 1887"""". Op schutblad: """"I"""". Behandelt veelal Bijbelse onderwerpen in het werk van Rubens. De chronologische afbakening lijkt niet te kloppen: de bundel bevat ook documenten van 1878 t.e.m. 1884 en van 1888 t.e.m. 1892. Rooses schreef op de eerste documenten in rood potlood """"vu"""". 

De bundel van oorspronkelijk 10 katernen werd wegens conservatorische overwegingen gedemonteerd en de stukken worden nu in individuele mapjes bewaard, apart van de kaft.",Algemeen,Nederlands
4a4a46e3-0de4-599f-a2ee-4a159e0385d4,tg:rubdoc:4229,Annotations,1,note.rubalg,"Rooses schreef in potlood bovenaan de brieven het onderwerp van het werk van Rubens waarover ze handelen. De brieven zijn geordend op dit onderwerp.
    
Etiket op rug: """"Oeuvre de Rubens 1887 / 1891"""". Op schutblad: """"II"""". Behandelt afbeeldingen van heiligen en mythologische thema's in het werk van Rubens. De chronologische afbakening lijkt ook hier niet te kloppen: de bundel bevat ook documenten van 1878, van 1880 t.e.m. 1886 en van 1892. 

De bundel van oorspronkelijk 10 katernen werd wegens conservatorische overwegingen gedemonteerd en de stukken worden nu in individuele mapjes bewaard, apart van de kaft.",Algemeen,Nederlands
cd1168e0-7a6a-5958-a1ad-d99aa160b42b,tg:rubdoc:4233,Annotations,1,note.rubalg,"Etiket op rug: """"Tentoonstelling Jordaens / België 8 December 1904 tot 18 Juli 1905 / Dagbladen 23 Januari 1905 tot 27 ber [sic] 1905"""".  

Deze bundel bestaat uit twee delen:   
  
- Het eerste deel bevat voornamelijk briefwisseling aan Rooses in verband met de voorbereidingen van de tentoonstelling (o.a. de bruiklenen). De ingebonden brieven dateren uit de periode van 8 december 1904 tot en met 18 juli 1905 en zijn chronologisch geklasseerd. Hier zit één brief tussen die gedateerd is 29/06/1904, maar het zou kunnen dat het jaartal er fout op staat en zo werd hij ook ingeklasseerd door Rooses (als zijnde 1905). Eén latere brief van 25/11/1905 werd los vooraan toegevoegd.  
Tussen de brieven zitten heel wat bijkomende documenten, zoals visitekaartjes, lijsten van kunstwerken, notities, drukwerk in verband met de tentoonstelling (rondzendbrieven, aankondiging, uitnodigingen, verzekeringsformulieren, documenten in verband met transport kunstwerken, ...), foto's van kunstwerken, krantenknipsels en postkaarten. Verder ook nog een schetsje van een kunstwerk, een rondzendbrief van het Congres van Kunst- en Letterkundigen Eigendom in België, een uitnodiging aan Rooses voor een feestmaal en een proces-verbaal en overdruk van de gemeenteraad van Antwerpen.  
De eerste brieven (december 1904 - maart 1905) zaten tijdens inventarisatie achteraan in de bundel. Deze orde werd hersteld.  
Er werden achteraan twee documenten (een gedrukte rondzendbrief door Rooses geannoteerd en een geschreven brief daterende 19/05/1905) terug toegevoegd die verkeerdelijk in de bundel van de tentoonstelling *L'Art Belge au XVIIe siècle* terecht waren gekomen (zie ook RA 006 / 011; map 32 en 33). 

- Het tweede deel van de bundel omslaat op papier gekleefde knipsels uit kranten en tijdschriften, daterende van 23/01/1905 t.e.m. 4/11/1905. In de eerste katern zit een enkel los excerpt uit literatuur.",Algemeen,Nederlands
cd1168e0-7a6a-5958-a1ad-d99aa160b42b,tg:rubdoc:4233,Annotations,2,note.rubalg,"De bundel van oorspronkelijk 18 (15+3) katernen werd wegens conservatorische overwegingen gedemonteerd en de stukken worden nu in individuele mapjes bewaard, apart van de kaft.",Algemeen,
439b5b4d-a57a-5b41-9a6f-f4599efabfa4,tg:rubdoc:4225,Annotations,1,note.rubalg,Donated to the Rubenianum by Karsten Evers (Hans Gerhard Evers' youngest son) in 2019.,Algemeen,Nederlands
