ResourceID,brocade.id,card,order,source_field,Description,Description Type,Description Language
613902e2-2997-5a6c-a40c-c1bc999f4006,tg:lhbr:298101,e73_Descriptions,,id.desc,Christina Guirlande aan Hubert Lampo,descriptive note,Nederlands
3b3d6b49-926b-5ad6-851d-a345876b049a,tg:lhbr:266469,e73_Descriptions,,id.desc,Brief van Giovanni Costelli,descriptive note,Nederlands
86cf2e3a-5a91-5292-b0a8-25177beb6afb,tg:lhbr:32230,e73_Descriptions,,id.desc,Brieven aan zijn moeder,descriptive note,Nederlands
55385b2e-6089-5e53-846e-2d9285a80ed3,tg:lhbr:275502,e73_Descriptions,,id.desc,Brieven van Emmanuel de Bom aan uitgeverij Het Pennoen,descriptive note,Nederlands
62f3460d-5b66-5773-93b6-471f9576ee51,tg:lhbr:247419,e73_Descriptions,,id.desc,Brieven van Brigitte von Heineccius,descriptive note,Nederlands
7a106ea6-8718-526a-b40c-8ba89ce05309,tg:lhbr:236809,e73_Descriptions,1,note.lhcontentbr,"<p>Geschenk Frans Van den Heuvel, Hombeek.</p>
",descriptive note,Nederlands
d40f6c18-01ca-5f13-abb9-f2ad10ef0822,tg:lhbr:254572,e73_Descriptions,,id.desc,Briefkaart van Fernand Toussaint E. de Bom,descriptive note,Nederlands
6634276c-673a-529b-8312-dad356183e5a,tg:lhbr:114384,e73_Descriptions,,id.desc,Brief aan Mevr. Gustaaf Spa,descriptive note,Nederlands
6624290e-edc3-5948-9496-addf724412b6,tg:lhbr:278091,e73_Descriptions,,id.desc,Ministerie van Openbaar Onderwijs aan E. de Bom,descriptive note,Nederlands
2091f69e-a7c8-5efa-a3cb-f3fe6830ec3c,tg:lhbr:298079,e73_Descriptions,,id.desc,Mark Grammens aan Hubert Lampo,descriptive note,Nederlands
a7116196-cee6-58cf-94ab-be29e64edd89,tg:lhbr:266511,e73_Descriptions,,id.desc,Brief van Chambre Belge des comptables,descriptive note,Nederlands
9016a9be-b662-5a08-9f19-c02cc65da689,tg:lhbr:240527,e73_Descriptions,,id.desc,brief van Adolf Spemann,descriptive note,Nederlands
802e008a-43d0-5229-aef2-c9c1815267ab,tg:lhbr:117196,e73_Descriptions,,id.desc,Brief aan zijn familie,descriptive note,Nederlands
fa0ad745-2a62-5791-92f6-5d0ecfce1e41,tg:lhbr:249398,e73_Descriptions,,id.desc,Brieven van Edmund Bartlomiejczyk,descriptive note,Nederlands
76ea73be-d4a7-548d-bb7d-e4e6fff5632d,tg:lhbr:267982,e73_Descriptions,,id.desc,Betreft zilveren medaille voor 'Heldenmoed der Vlamingen tegen de Franschen onder het bestuur van Guido van Dampierre'.,descriptive note,Nederlands
7ba18f88-186b-5bd7-bff5-a8eb042d85b4,tg:lhbr:247409,e73_Descriptions,,id.desc,Brieven van Brigitte en Benno von Heineccius,descriptive note,Nederlands
0c9b5e26-f0f6-5c4f-a961-7714c03adde6,tg:lhbr:260135,e73_Descriptions,,id.desc,Brieven van Jean Taillard,descriptive note,Nederlands
293ed4a4-9c46-5dcc-82b5-d8fe135831ea,tg:lhbr:266479,e73_Descriptions,,id.desc,Brief van Gustave Coquiot,descriptive note,Nederlands
5f834a97-927e-5c5b-910a-27543e9ee5c9,tg:lhbr:298111,e73_Descriptions,,id.desc,Hubert Lampo aan Jos van Elewyck,descriptive note,Nederlands
f24eb288-031f-5567-a37b-c4492d6085c0,tg:lhbr:74094,e73_Descriptions,,id.desc,Brief aan zijn meter,descriptive note,Nederlands
16ee7ec7-fb59-5b2c-ae19-f0db15c686d5,tg:lhbr:259810,e73_Descriptions,,id.desc,Brieven van South African Broadcasting Corporation,descriptive note,Nederlands
9141b2d9-1ab3-50b2-ba53-18ac1c36e40b,tg:lhbr:240537,e73_Descriptions,,id.desc,brief van Rotraut Spemann,descriptive note,Nederlands
2803eec6-1b47-5d62-b672-34fe1eb44907,tg:lhbr:298069,e73_Descriptions,,id.desc,André Goezu aan Hubert Lampo,descriptive note,Nederlands
e48ebbfd-14db-5655-a89d-00477eb83de4,tg:lhbr:245311,e73_Descriptions,,id.desc,"Brief ondertekend door J.J. van Leeuwen, Utrecht",descriptive note,Nederlands
0ebb06fc-81aa-5137-b48f-3af840e89883,tg:lhbr:278860,e73_Descriptions,,id.desc,Lodewijk Janssens aan Emmanuel de Bom,descriptive note,Nederlands
b20f6a38-59d6-53be-bd3e-aab740eafea4,tg:lhbr:273328,e73_Descriptions,,id.desc,"Dankbriefje van Van Duyse aan zijn vriend Peron, omwille van diens felicitaties om Van Duyse´s verheffing tot ridder in de Leopoldsorde.",descriptive note,Nederlands
8282d090-a713-5f30-a321-a98f9cea75b7,tg:lhbr:243453,e73_Descriptions,,id.desc,"Brief van SMET,P.J.de",descriptive note,Nederlands
c4b84d1f-2372-5005-b0fb-bf638904ea4f,tg:lhbr:262423,e73_Descriptions,,id.desc,Brief gericht aan Mieke Ontrop,descriptive note,Nederlands
bb0d4e79-64f1-5a16-aabe-18b3a3dd037e,tg:lhbr:298267,e73_Descriptions,,id.desc,Herwig Hensen aan Hubert Lampo,descriptive note,Nederlands
44571bbb-7515-57ac-801e-c3b90e86ce32,tg:lhbr:297975,e73_Descriptions,,id.desc,Gaston Durnez aan Hubert Lampo,descriptive note,Nederlands
130a717e-1b66-5f6a-9c4a-3e795a8d8519,tg:lhbr:250440,e73_Descriptions,,id.desc,Brieven van Pieter Geyl,descriptive note,Nederlands
14c7e904-0e57-513f-9064-728889f33535,tg:lhbr:266677,e73_Descriptions,,id.desc,Brief van N. Heyndrickse,descriptive note,Nederlands
d9a92bf8-5b2a-5c33-8c0e-65078862c5c6,tg:lhbr:249967,e73_Descriptions,,id.desc,Brieven van Desiderius de Fay,descriptive note,Nederlands
146f53ec-85e1-566f-a644-7c6147b995b7,tg:lhbr:240641,e73_Descriptions,,id.desc,brief van Adolf Spemann,descriptive note,Nederlands
9edc6b0a-0617-5f3f-9f08-478a20456a60,tg:lhbr:252220,e73_Descriptions,,id.desc,Brieven van Marcel Say,descriptive note,Nederlands
10824d52-307e-588c-b514-934ccb77ae1c,tg:lhbr:298277,e73_Descriptions,,id.desc,Hubert Lampo aan Raymond Herreman,descriptive note,Nederlands
64fa1d65-7315-57a6-ae33-521a54937414,tg:lhbr:240729,e73_Descriptions,,id.desc,brief van Anton Kippenberg,descriptive note,Nederlands
6c3f149f-e4bf-5060-9899-54407b319e3e,tg:lhbr:265475,e73_Descriptions,,id.desc,E. de Bom aan Leo Simons,descriptive note,Nederlands
2507680b-5a3c-5791-9555-a1b1d470f7ad,tg:lhbr:240651,e73_Descriptions,,id.desc,brief van Adolf Spemann,descriptive note,Nederlands
fa66beb7-cd06-5a0b-a9cf-c99840449aa7,tg:lhbr:266667,e73_Descriptions,,id.desc,Brief van Pierre Houbrechts,descriptive note,Nederlands
57196b8b-865f-511b-a1be-e3d8d47e0e7b,tg:lhbr:250450,e73_Descriptions,,id.desc,Brieven van Robert Foncke,descriptive note,Nederlands
745ef2e9-7d13-5d59-95e0-2ebe6b8f427a,tg:lhbr:297965,e73_Descriptions,,id.desc,Michel Dupuis aan Hubert Lampo,descriptive note,Nederlands
2e0dc00a-5fe7-5609-bd4d-5b4bac177af5,tg:lhbr:265230,e73_Descriptions,,id.desc,Frits Hopman [Nieuwe Rotterdamsche Courant] aan E. de Bom,descriptive note,Nederlands
57b9b746-51c4-585e-b80f-a1d5cd08c388,tg:lhbr:277651,e73_Descriptions,,id.desc,Lode Baekelmans aan E. de Bom,descriptive note,Nederlands
925b367a-313a-5ba0-88ad-42ffab689860,tg:lhbr:267450,e73_Descriptions,,id.desc,Brief van René Beeken,descriptive note,Nederlands
f078f79d-3ae1-5baf-8a98-a5a281be9100,tg:lhbr:299138,e73_Descriptions,,id.desc,Bert van Kerkhoven aan Hubert Lampo,descriptive note,Nederlands
392ab4bb-ed27-5929-8573-d20dfd7c6a5c,tg:lhbr:254139,e73_Descriptions,,id.desc,Twee brieven van Top Naeff,descriptive note,Nederlands
3408e90e-c15c-52ed-a2ab-b48f222c60d2,tg:lhbr:246558,e73_Descriptions,,id.desc,Brieven van Albert Nauck Verlag,descriptive note,Nederlands
8715e993-9ba8-5924-ba36-defc33610ace,tg:lhbr:293595,e73_Descriptions,,id.desc,Roger Grignard aan Hubert Lampo,descriptive note,Nederlands
c82a119c-a5f1-58f9-bb10-968ed294ccb6,tg:lhbr:263604,e73_Descriptions,,id.desc,Deze brief aan Heren van 't Groot  Karnavalfeest te Keulen .,descriptive note,Nederlands
584e91f1-f31f-5979-984c-e7da0d951671,tg:lhbr:299128,e73_Descriptions,,id.desc,Keesings Historisch Archief aan Hubert Lampo,descriptive note,Nederlands
ea397a80-2b19-5e57-870a-1abc1004a8d0,tg:lhbr:267440,e73_Descriptions,,id.desc,Brief van René Beeken,descriptive note,Nederlands
af6bc056-66b4-535f-a603-8c1f04b5be3f,tg:lhbr:4764,e73_Descriptions,,id.desc,Brief aan juff. R. Coppieters,descriptive note,Nederlands
8487ef26-8258-589a-a31b-e3e70ff6cb6f,tg:lhbr:37135,e73_Descriptions,,id.desc,Brief aan Dhr. Vanderbilt te New York (USA),descriptive note,Nederlands
83234e2b-bf4c-5c5c-a204-836a7761406b,tg:lhbr:237820,e73_Descriptions,1,note.lhcontentbr,"<p>Getuigenis van Jan Vercammen over zijn echtscheiding met afschrift van brief van Albert Westerlinck aan Jan Vercammen, (7.10.1942) (p. 1-3) en afschrift van brief van Westerlinck aan mevr. Jan Vercammen (s.d.) (p. 4).</p>
",descriptive note,Nederlands
1ae42dc2-108d-5614-8594-17959a8774d2,tg:lhbr:265220,e73_Descriptions,,id.desc,De Nieuwe Rotterdamsche Courant aan E. de Bom,descriptive note,Nederlands
b90d4d42-7955-5176-a440-ff4190a1a722,tg:lhbr:244328,e73_Descriptions,,id.desc,"Brief van Wouters, D.",descriptive note,Nederlands
21c0dc9e-a4f9-504e-92ce-21ff6a4e55f9,tg:lhbr:250205,e73_Descriptions,,id.desc,Brieven van Marie Belpaire,descriptive note,Nederlands
5bd4efa8-0361-5c36-aad3-24c2a455d05d,tg:lhbr:261074,e73_Descriptions,,id.desc,Deze brief van Van Roo .,descriptive note,Nederlands
b6970ecc-b5e9-5928-bfc0-5c2219cb9854,tg:lhbr:299845,e73_Descriptions,,id.desc,Danny de Laet aan Hubert Lampo,descriptive note,Nederlands
578c75dc-47cc-5935-b5bc-967b7c36bfb4,tg:lhbr:104452,e73_Descriptions,,id.desc,Brief aan Mevr. Ep. Deroye,descriptive note,Nederlands
abbc65ba-246e-57f3-9f87-6f9fb3141f9a,tg:lhbr:297725,e73_Descriptions,,id.desc,Walter Beckers,descriptive note,Nederlands
191aa998-38db-53a5-b4c5-c7e6469a4553,tg:lhbr:293409,e73_Descriptions,,id.desc,"Uit bundel gedemonteerde stukken. Briefwisseling aan Rooses vanuit Parijs, Den Haag, Rotterdam, Brussel over Rubens' werk. Enkele financiële stukken.",descriptive note,Nederlands
95ba2201-294e-5276-b890-439fa0d7356d,tg:lhbr:240969,e73_Descriptions,,id.desc,Postkaart aan Louis Franck,descriptive note,Nederlands
89686ef0-82b1-57d2-8d84-dc08675e4050,tg:lhbr:263788,e73_Descriptions,,id.desc,7 pagina´s,descriptive note,Nederlands
98a55f72-6a6e-5b8c-91e8-ecd478b44b16,tg:lhbr:297735,e73_Descriptions,,id.desc,Walter Beckers aan Hubert Lampo,descriptive note,Nederlands
f7cd44d0-bb64-59cf-9520-3172e2a1d992,tg:lhbr:254854,e73_Descriptions,,id.desc,Brieven van Emmanuel de Bom aan Firmin van Hecke (Ministerie van Kunsten en Wetenschappen),descriptive note,Nederlands
cd4d9c60-319c-5a18-a9dc-fb90247a6eba,tg:lhbr:18620,e73_Descriptions,,id.desc,Brief aan zijn familie,descriptive note,Nederlands
4b5ba32f-7a07-5358-9190-b993c1719083,tg:lhbr:240979,e73_Descriptions,,id.desc,Postkaart aan Fritz Francken,descriptive note,Nederlands
488810e5-23f5-5c7f-9035-07377a343fe0,tg:lhbr:286146,e73_Descriptions,,id.desc,Brief m.b.t. artikel 'Toeristische biecht',descriptive note,Nederlands
1d519f5e-a7ea-52ce-b192-528723bdfb44,tg:lhbr:147831,e73_Descriptions,,id.desc,Brief aan zoontje Tots,descriptive note,Nederlands
5617f23d-5034-5ec0-9595-4b82008ed01a,tg:lhbr:265481,e73_Descriptions,,id.desc,ALMO aan E. de Bom,descriptive note,Nederlands
9add520c-b354-5813-ad44-26c4385488b3,tg:lhbr:246291,e73_Descriptions,,id.desc,Brieven van Sternheim J,descriptive note,Nederlands
99437898-c4d0-520f-92a5-62f6cc7e2df1,tg:lhbr:298283,e73_Descriptions,,id.desc,Hubert Lampo aan Raymond Herreman,descriptive note,Nederlands
1b331e6c-8305-51c6-9bf8-10a457e63a20,tg:lhbr:237718,e73_Descriptions,2,note.lhcontentbr,"<p>Fotocopie uit het archief van Dirk Coster.</p>
",descriptive note,Nederlands
335f083c-4c90-5381-9538-4f3af9241d0a,tg:lhbr:297991,e73_Descriptions,,id.desc,Davidsfonds Ekeren aan Hubert Lampo,descriptive note,Nederlands
cd21be21-ff61-5a73-a532-cfc945289da6,tg:lhbr:297008,e73_Descriptions,,id.desc,Ambassade van België te 's Gravenhage aan Hubert Lampo,descriptive note,Nederlands
d8537018-d750-57d6-a98c-1c7dae8b0b1a,tg:lhbr:293324,e73_Descriptions,,id.desc,"Uit bundel gedemonteerde stukken. ""Commission Rubens/1882 - 1885"" - briefwisseling Rooses - Ruelens",descriptive note,Nederlands
40977dec-9fb7-57f2-93c6-3949a9cdcc4d,tg:lhbr:216778,e73_Descriptions,1,note.lhcontentbr,"<p>Toekenning van een creatiepremie voor &quot;Ballade van Bloed en Tranene</p>
",descriptive note,Nederlands
