ResourceID,brocade.id,card,order,source_field,Description,Description Type,Description Language
f054665f-e89b-5527-b4be-e1d47a4263cb,tg:lhph:30552,Descriptions,1,id.desc,"Clara Haesaert, het hoofd naar rechts gedraaid. Borststuk.",descriptive note,Nederlands
87f8effb-7485-5d82-846f-99bff333cfc0,tg:lhph:37297,Descriptions,1,id.desc,Pagaddertoren in Gent.,descriptive note,Nederlands
8552fda5-f4c2-5a7e-8227-3626a972e7c1,tg:lhph:3721,Descriptions,1,id.desc,Lode Zielens met kunstschilder Marten Melsen en Emmanuel de Bom te Stabroek,descriptive note,Nederlands
a8cb1dec-0bf6-5695-b15b-645ff687a102,tg:lhph:51041,Descriptions,1,id.desc,"Jan van Nijlen, Eddy de Perron, Jan Greshoff en Franz Hellens in Gistoux.",descriptive note,Nederlands
ff50b330-23a5-5a54-be81-c61883a518b0,tg:lhph:2833,Descriptions,1,id.desc,Maurice Gilliams in de verte voor zich uit starend.,descriptive note,Nederlands
bfc0ee81-10b3-54bd-8ca4-61147179c437,tg:lhph:29289,Descriptions,1,id.desc,"Roger Raveel poserend aan zijn werk, ten voeten uit.",descriptive note,Nederlands
94fe2532-900e-5ed6-ba1f-becb3618e2da,tg:lhph:23684,Descriptions,1,id.desc,"Stedelijk Instutuut voor Sierkunsten en Ambachten (SISA).

Frans Dille op schoolfeest collega's.",descriptive note,Nederlands
f90accfd-a381-51aa-a1d4-83618b68b83f,tg:lhph:24141,Descriptions,1,id.desc,"Jan Vanderheyden, portretfoto",descriptive note,Nederlands
05d64298-749d-55d1-aac7-937d9ecf5d20,tg:lhph:42397,Descriptions,1,id.desc,"Robert van Passen, borststuk met armen gekruist, buitenopname, naar links gericht.",descriptive note,Nederlands
4c4c99a5-d95e-5ec7-92c2-8931ced9578a,tg:lhph:13232,Descriptions,1,id.desc,"Theodoor Jozef Burton, borststuk.",descriptive note,Nederlands
c9f0c3b6-c6d2-523c-ad8e-eed3a791e11a,tg:lhph:45452,Descriptions,1,id.desc,"Anna Delvigne, als Melisande, in """"Pelleas en Melisande"""" van Claude Debussy.",descriptive note,Nederlands
f38c9cdd-2aff-5406-a5fb-831ee705ab9b,tg:lhph:22996,Descriptions,1,id.desc,Alice Nahon; portret 3/4 in zetel.,descriptive note,Nederlands
2a644055-3257-5800-85cb-54a393c05a4f,tg:lhph:38162,Descriptions,1,id.desc,"Yvonne de Man; (album)- samen met haar familie aan zee,- haar broer Robert met zijn zeilbootje op het strand.",descriptive note,Nederlands
65e19c5f-74bd-564c-a680-7a88e1099b2d,tg:lhph:47195,Descriptions,1,id.desc,"Familiefoto gezin Ernest Martens-Eugenie Van den Dorpe. Vlnr: Nestor, Julienne, Paul, Angèle, Germaine, Rosalie Van den Dorpe (zus van Eugenie), Aurèle, moeder Eugenie, vader Ernest, Gaston (met viool) en Michel.",descriptive note,Nederlands
525cb592-4469-5472-a28b-915d0df4c87b,tg:lhph:729,Descriptions,1,id.desc,Raymond Brulez en kleindochter Francesca. Close-up van Francesca,descriptive note,Nederlands
2797e9e0-bec9-5b57-a6f8-e2b7a91c5d61,tg:lhph:16030,Descriptions,1,id.desc,"Vlaamse Poëziedagen, Deurle, 1974. Arthur-Kamiel Rottiers.",descriptive note,Nederlands
4a6baaba-17fa-558f-965c-e7b475dac7c6,tg:lhph:40650,Descriptions,1,id.desc,"Ward Ruyslinck, rokend. Borststuk.",descriptive note,Nederlands
e8d3e385-f479-5b92-bf4a-b97898fa3ff1,tg:lhph:38498,Descriptions,1,id.desc,"Helena Bertrijn in """"Aladijn"""".",descriptive note,Nederlands
97d26865-82f1-5053-8403-0e505e73c673,tg:lhph:41942,Descriptions,1,id.desc,"Emiel Willekens, portret, borststuk.",descriptive note,Nederlands
37e8668f-2309-5ed4-806b-b10a19c582e7,tg:lhph:26486,Descriptions,1,id.desc,"Clément Pardon (familie): zijn zuster Palmyre-Henriette Pardon met Nicolette, dochter van Leonie Pardon.",descriptive note,Nederlands
8978b3d2-be52-55ac-ac4c-9d80011fefc1,tg:lhph:21343,Descriptions,1,id.desc,"Philip van Isacker, Statieportret met opdracht aan F.V.C en Mevr. V.C.",descriptive note,Nederlands
6e266dd2-fa2a-52eb-9ac8-0529eb50a2ed,tg:lhph:29773,Descriptions,1,id.desc,"J. Oscar de Gruyter; met een groep van het """"Fronttoneel"""" op tournee in Duitsland.",descriptive note,Nederlands
fb79167a-c5de-5918-9e71-25755e3a8b08,tg:lhph:53586,Descriptions,1,id.desc,"Film 45  
- Tulpentuil  
- Familiegroepen  
- Paula en haar gezin  
- Sterfbed en begrafenisstoet dochtertje Verhoest  
- Processie in Ingooigem  
- Paula met Eric",descriptive note,Nederlands
14284bdf-7a32-570d-83ad-818e882df6e8,tg:lhph:34842,Descriptions,1,id.desc,"Arca-Kelderteater:

Rudi van Vlaenderen, in """"Klacht tegen onbekende"""", door Georges Neveux en onder
regie van Dré Poppe.",descriptive note,Nederlands
59db60fd-5b91-58fb-8721-f79bcc62f64f,tg:lhph:35750,Descriptions,1,id.desc,"Ida Wasserman als Frolla (1te v.l.) met o.a. Leo de Hartogh (2de v.l., zittend) in een toneelstuk van Luigi Pirandello.",descriptive note,Nederlands
c2aa9ae8-0c83-52c3-ac9e-23d097803010,tg:lhph:48260,Descriptions,1,id.desc,Opvoering van Zachtjes met de deuren door het Reizend Volkstheater. <p> Op de foto staan Danni Heylen (Danielle) en Roger Thoelen (Vader).,descriptive note,Nederlands
c42f4b17-eed4-5b74-bd6b-1059a9a41d7a,tg:lhph:28861,Descriptions,1,id.desc,Jan J. Verhoeven. Borststuk.,descriptive note,Nederlands
b692481a-9b2a-5ad9-9060-eea7c0a4fccd,tg:lhph:32095,Descriptions,1,id.desc,Hubert de Vries (2de v.l.). Viering van 80e verjaardag.,descriptive note,Nederlands
e719f44a-712c-5df1-a3c0-a1d5f5191ffd,tg:lhph:6523,Descriptions,1,id.desc,"Hulde van Frans Daels aan de Limburgse slachtoffers, tijdens de vijfentwintigste IJzerbedevaart.",descriptive note,Nederlands
6ff9cac8-9b83-5c98-b844-5fa6712e8ff6,tg:lhph:30102,Descriptions,1,id.desc,"Karel Jonckheere:

Inschepend op de s/s United States.",descriptive note,Nederlands
b14cf90b-19a9-5639-a891-8d9f62d7308b,tg:lhph:6489,Descriptions,1,id.desc,"Het Renaat de Rudder-koor tijdens de dertigste bedevaart, het jaar waarin oud-voorzitter prof. Daels 75 jaar oud werd.",descriptive note,Nederlands
572bd27f-1ce0-5037-9ba3-77b0cebd2b9f,tg:lhph:3371,Descriptions,1,id.desc,Marnix Gijsen met de ambassadeur van de Verenigde Naties Walter Loridan.,descriptive note,Nederlands
c2a62fab-721e-5a30-89f9-b5c344cf7b9a,tg:lhph:683,Descriptions,1,id.desc,Hubert Lampo. Hoofd.,descriptive note,Nederlands
70bd4cdd-21c7-502d-bca2-13bb2cdf2b5e,tg:lhph:38532,Descriptions,1,id.desc,"Portret van Louis Bertrijn, ten halve lijve.",descriptive note,Nederlands
b7f71443-04d8-5bbd-9c77-4ef829d3128f,tg:lhph:45002,Descriptions,1,id.desc,"Alfons Darden in de rol van """"Arme Paljas"""", Folies Bergère, Brussel, bij zijn zilveren toneeljubileum geschonken aan een familielid, Mejuffer Jeanne Otquet.",descriptive note,Nederlands
e6c63e10-2388-5053-a7dc-848c16b55172,tg:lhph:13662,Descriptions,1,id.desc,"Jan Cleppe, met de handen in zijn broekzak.",descriptive note,Nederlands
b92a5a30-856c-5117-82f7-a6c8a9f4a76c,tg:lhph:12970,Descriptions,1,id.desc,"Stephanie Claes, kijkend in een boek.",descriptive note,Nederlands
8f25fc0d-ef47-52bb-9d31-166d022a83b1,tg:lhph:24511,Descriptions,1,id.desc,May Néama; - haar klasje in de YWCA.,descriptive note,Nederlands
44c6058d-619c-5778-a18b-9c53e437cd07,tg:lhph:20801,Descriptions,1,id.desc,Frans van Cauwelaert feliciteert de moeder van Professor Heymans bij de viering van de zestigste verjaardag van de professor.,descriptive note,Nederlands
8e0a6f52-ced8-5493-be2a-9f664a8a7e94,tg:lhph:40200,Descriptions,1,id.desc,KVM-reis naar Duitsland; A. Dosfel (rechts) met professor Jacob en 'M.W.'.,descriptive note,Nederlands
1f59a08b-dda1-5fca-b834-cb8a1694a9a6,tg:lhph:16460,Descriptions,1,id.desc,Jeanne van Rijn. Borststuk.,descriptive note,Nederlands
3843043e-654e-5213-b654-9551a1c436ea,tg:lhph:9286,Descriptions,1,id.desc,Alexis Callant. Borststuk. Zittend met gezicht naar rechts.,descriptive note,Nederlands
98ccd930-9117-545b-999e-861da6ef129f,tg:lhph:13398,Descriptions,1,id.desc,"Louise Bonepte, borststuk.",descriptive note,Nederlands
f4602664-7a75-53c0-8bb1-e602566ac8ca,tg:lhph:35300,Descriptions,1,id.desc,"Jan van Beers Jr. aan tafel op terras. V.l.n.r. ' Tante Rosé', Jan de Braey, Robert de Man en Jan van Beers Jr.",descriptive note,Nederlands
d993a635-cd92-5b5a-aafb-f1b934d540e4,tg:lhph:19795,Descriptions,1,id.desc,Gerard Walschap in Spanje. Ten voeten uit.,descriptive note,Nederlands
d1094849-49c8-5741-ab6e-c43cd84d5b0f,tg:lhph:6173,Descriptions,1,id.desc,"Gustave van de Woestijne in zijn Mechelse periode, hoofd.",descriptive note,Nederlands
35175593-a3c4-5c05-b4c0-125ad2500487,tg:lhph:18887,Descriptions,1,id.desc,"Emanuel Hiel, kijkende naar links. Borststuk.",descriptive note,Nederlands
2d82c565-4453-55c7-9c00-5af06f09de12,tg:lhph:29323,Descriptions,1,id.desc,"Irène Raymakers,- portret van Frans Völker, gesigneerd.",descriptive note,Nederlands
838a98b8-79ed-56ea-b03c-03d258c32f41,tg:lhph:2999,Descriptions,1,id.desc,Hugo Verriest. Ten halven lijve.,descriptive note,Nederlands
f0d39d46-ca0f-5ef7-a63b-1217fbf2810a,tg:lhph:49922,Descriptions,1,id.desc,"Else Flim, in wit hemd, kijkt verbaasd naar voren. Ze staat in de hoek van de kamer.",descriptive note,Nederlands
199277b1-fc7f-5ec0-91ee-468088c5bd63,tg:lhph:36486,Descriptions,1,id.desc,"Arca-Kelderteater:

Drie onbekenden, in """"School voor Schrijvers"""", door Eugène Ionesco en onder
regie van Dré Poppe.",descriptive note,Nederlands
dd6ae150-d001-5b01-9d46-1eb38ee1feb5,tg:lhph:2130,Descriptions,1,id.desc,"Valère Depauw, close-up, driekwartprofiel.",descriptive note,Nederlands
cc3aca53-19d4-5edc-a04d-b0ee39188a24,tg:lhph:31343,Descriptions,1,id.desc,"Charel Janssens; portret, borststuk.",descriptive note,Nederlands
e2f86e48-3d0a-5046-993c-75a7f93d7ca7,tg:lhph:28498,Descriptions,1,id.desc,Geo Vindevogel. Borststuk.,descriptive note,Nederlands
ede65729-3df0-5929-8d4d-3db8749cd983,tg:lhph:25750,Descriptions,1,id.desc,"Karel Jonckheere; borststuk, naar links gericht.",descriptive note,Nederlands
c430702c-64ae-5893-9cfc-c51bcf64b8de,tg:lhph:22095,Descriptions,1,id.desc,Fernande Hougaerts aan het spelen van een rol.,descriptive note,Nederlands
982c5a1d-4245-5bbd-a9a2-42789c4e82b4,tg:lhph:38861,Descriptions,1,id.desc,"Arca-Kelderteater:

Een vrouw samen met een man, in """"Privaat voor oren en Publiek voor ogen"""", door
Peter Shaffer en onder regie van Dré Poppe.",descriptive note,Nederlands
e368da7c-3c64-56f2-b777-28c79e0ee3a3,tg:lhph:39773,Descriptions,1,id.desc,"Georges Meir, aan de aula van de Universiteit Gent in de Voldersstraat.",descriptive note,Nederlands
faa21d16-2c0d-5edf-9bae-98a024d2f6f7,tg:lhph:44243,Descriptions,1,id.desc,Marthe Donas in haar atelier te Parijs,descriptive note,Nederlands
a4c17d5e-5855-563b-b2b0-a36249938212,tg:lhph:12423,Descriptions,1,id.desc,"van den Broeck Désiré, met viool in de hand.",descriptive note,Nederlands
8b88944e-bfa9-5105-aa29-a3888d45a63e,tg:lhph:43586,Descriptions,1,id.desc,"Achilles Mussche, Henriette Roland Holst met verpleegster",descriptive note,Nederlands
c089ea6c-0779-5a66-9db6-4dd2be3682d3,tg:lhph:24842,Descriptions,1,id.desc,"Nieuw Ensemble Raamteater: """" August """" van Pavel Kohout; scenefoto.",descriptive note,Nederlands
9d750fc3-d4c4-5822-b261-0e9b57befd17,tg:lhph:41041,Descriptions,1,id.desc,René Milio buigt voor het publiek tijdens een optreden van het 'Kultuur' koor.,descriptive note,Nederlands
21b4c90c-5ae3-5088-b88f-23bacbe8fa71,tg:lhph:17621,Descriptions,1,id.desc,Herwig Hensen uiterst rechts. Flor Mielands = Vader,descriptive note,Nederlands
8ca2013d-d6b2-5ced-a5bb-cb0256e722b1,tg:lhph:39289,Descriptions,1,id.desc,"Toneel S.O.L.:

Een meisje, met pet op, in het stuk """"Domme Hannes"""", door Jan Peeters.",descriptive note,Nederlands
5d0bb0ee-f08a-54a1-9261-11aea3ac27f0,tg:lhph:46784,Descriptions,1,id.desc,"Jan Eelen, portret.",descriptive note,Nederlands
97e1dff9-866f-5746-816d-914cdc0b19da,tg:lhph:47896,Descriptions,1,id.desc,Aurélie Nemours tijdens de tentoonstelling van 'Wizo' in oktober 1975,descriptive note,Nederlands
cd181cad-5222-5c13-8190-318f21298963,tg:lhph:27297,Descriptions,1,id.desc,"Ann Petersen, Portret, met hand aan haar kaak.",descriptive note,Nederlands
f3d93139-34b5-5052-b813-0d316c55c2aa,tg:lhph:16933,Descriptions,1,id.desc,Oscar van der Hallen.,descriptive note,Nederlands
09e646b3-13c3-554e-9ee9-3b6575cdb877,tg:lhph:52397,Descriptions,1,id.desc,Villa in De Panne / Stijn Streuvels,descriptive note,Nederlands
fcfeb626-f3da-5939-b09e-88aa1110811d,tg:lhph:28162,Descriptions,1,id.desc,"Inhuldiging van het beeld """"Sint Willebrordus"""" van Albert Poels.",descriptive note,Nederlands
8897571d-1c70-5f9e-ba4a-4abe981dbd8a,tg:lhph:32996,Descriptions,1,id.desc,De Kempen; een open schuur te Wechelderzande.,descriptive note,Nederlands
a7c6a91a-1d11-5552-a190-eb17d7d57e55,tg:lhph:33684,Descriptions,1,id.desc,"Staf Knop, portret, aan zijn schrijfmachine, borststuk.",descriptive note,Nederlands
ffe4eee3-3d6e-5685-932e-5813da029e26,tg:lhph:7332,Descriptions,1,id.desc,Dirk Vansina zit met Fons Fraeters in de tuin achter een tafeltje.,descriptive note,Nederlands
90192338-7b0a-5c15-b5bc-8691b296e7f4,tg:lhph:49471,Descriptions,1,id.desc,"Filmscène van een man met witte baard gekleed in een 'exotische' klederdracht die twee borden vasthoud met daarop 12 eerste Romeinse cijfers. Een scène, vermoedelijk uit 'Hollywood speaking' (1959) een parodie op Hollywood.",descriptive note,Nederlands
cd663574-8f69-57b9-95ee-1da7ae727d93,tg:lhph:34141,Descriptions,1,id.desc,"Lode Baekelmans op 80-jarige leeftijd, hoofd.",descriptive note,Nederlands
58aa95b1-4d5e-527e-ab37-06c3b45e4651,tg:lhph:30801,Descriptions,1,id.desc,Voorstelling dichtbundel 'De tuin van Cathérine' van Jo Gisekin in het Archief en Museum voor het Vlaamse Cultuurleven. Leentje Vandenmeulenbroecke signeert.,descriptive note,Nederlands
8bf06cc4-4b58-5fe9-9a29-608141d9915b,tg:lhph:50200,Descriptions,1,id.desc,Begrafenis van Jan Alfried de Laet,descriptive note,Nederlands
a89bf226-0b74-5eb8-a244-23a0e80e7ef3,tg:lhph:7298,Descriptions,1,id.desc,Frans Verschoren neemt afscheid van Stijn Streuvels en zijn echtgenote Alida Lateur. Ten voeten uit.,descriptive note,Nederlands
92e5e3e3-5425-5684-a19a-d57135de6a1c,tg:lhph:2560,Descriptions,1,id.desc,Kasteel Duurstede (Nederland). Genealogie van Maurice Gilliams (Sucquet).,descriptive note,Nederlands
208b35b9-4ab1-59f5-a5ba-70f1d29341dc,tg:lhph:31713,Descriptions,1,id.desc,Denise Geirlandt en Chris Straetling met de documenta-zwaan voor het Fridricaneum op weg naar de rivier.,descriptive note,Nederlands
cd323fc3-3253-58fc-bfca-36b00b7cd7e0,tg:lhph:12073,Descriptions,1,id.desc,"Alfons Van Beurden , in gezelschap.",descriptive note,Nederlands
5e279465-fa41-5564-9fb0-f1809577cedd,tg:lhph:44613,Descriptions,1,id.desc,Hubert Lampo en Lucia Lampo,descriptive note,Nederlands
80b7ec5c-0e63-5314-baf0-d70dcc94a31c,tg:lhph:39323,Descriptions,1,id.desc,"Marcel Matthijs, portret, hoofd naar rechts gericht.",descriptive note,Nederlands
8b2325bb-756c-55e0-8351-2c2815024bb8,tg:lhph:25300,Descriptions,1,id.desc,Felix Timmermans (midden) bij de opening van de tentoonstelling van zijn tekeningen in het Museum van de Vlaamsche Letterkunde te Antwerpen.,descriptive note,Nederlands
1f837051-5067-5b6a-bb0b-e4996e6746c5,tg:lhph:45901,Descriptions,1,id.desc,Charles de Cort. Een verwante van Frans de Cort.,descriptive note,Nederlands
bbc918e2-8051-501a-a5e1-3c1509900a7a,tg:lhph:16899,Descriptions,1,id.desc,Jenny van Santvoort in dansbeweging.,descriptive note,Nederlands
9e769312-3a30-51df-bae0-8d9ef087cfd4,tg:lhph:17271,Descriptions,1,id.desc,"Berthe Seroen als Amalia in """"Het Gemaskerd Bal"""" van Giuseppe Verdi.",descriptive note,Nederlands
153bc76d-6eb5-562f-aeea-36c181ff8d2e,tg:lhph:41411,Descriptions,1,id.desc,Beschadigingen aan de grote markt te Veurne 1918.,descriptive note,Nederlands
fc23b4b5-a6f6-521e-b4fa-d5c2799c33d8,tg:lhph:12589,Descriptions,1,id.desc,Begrafenis van Gustave Buschmann.,descriptive note,Nederlands
b4cfb4e3-aa46-59a2-9495-82a2578d688e,tg:lhph:8497,Descriptions,1,id.desc,Renaat de Vos. Zittend in de zetel.,descriptive note,Nederlands
4ddb0376-17f4-555d-8891-9d31096c9128,tg:lhph:18184,Descriptions,1,id.desc,"Eigen woning Flor van Reeth, Boekenberglei te Deurne, in opbouw (naast woning Everaerts).",descriptive note,Nederlands
bb558c5e-34ff-5ee4-a974-a90f0a0ff88b,tg:lhph:34511,Descriptions,1,id.desc,"Maria Liekens, borststuk. Bevrijd te München 1945.",descriptive note,Nederlands
8d42ea0f-eb50-50e0-b5bc-4d57f4f061be,tg:lhph:28532,Descriptions,1,id.desc,"Pieter de Prins; portret, close-up met hoed op.",descriptive note,Nederlands
8ac79404-a9b3-5af2-bf87-94d89d9ec5c1,tg:lhph:6870,Descriptions,1,id.desc,Groepsfoto,descriptive note,Nederlands
32d71454-b9a5-502d-9e03-cb851c6bbdb2,tg:lhph:15759,Descriptions,1,id.desc,"Marguerite Fauconnier, zittend aan tafel.",descriptive note,Nederlands
68985793-4ae6-58ae-8cd8-b826574e43d4,tg:lhph:43139,Descriptions,1,id.desc,"Borstbeeld van Karel Bulsin de K.V.S.

V.l.n.r.: Professor Foncke, burgemeester Cooremans en De Ruyter, directeur van
de K.V.S.",descriptive note,Nederlands
fcf740c5-31f6-5961-8945-f73450c1455f,tg:lhph:17764,Descriptions,1,id.desc,Jacob Frans Johan Heremans.,descriptive note,Nederlands
0e89a1f7-f5f7-56fa-b317-4acdada712a9,tg:lhph:41104,Descriptions,1,id.desc,De Franse cultuurminister Jack Lang (rechts) in gesprek met Karel Poma (midden) en Burgemeester Bob Cools.,descriptive note,Nederlands
65800d28-f952-5d44-8c4f-6e3d2f1cbd21,tg:lhph:8182,Descriptions,1,id.desc,"Karel van de Woestijne, hoofd gebeeldhouwd door J. Anteunis.",descriptive note,Nederlands
8534c1ca-2888-563d-a353-f0253f0269d6,tg:lhph:16876,Descriptions,1,id.desc,Elsa Van Hagendoren.,descriptive note,Nederlands
3281753e-11aa-5a5f-8d7c-50667a5859a2,tg:lhph:20417,Descriptions,1,id.desc,Jan Emiel Daele met Anne-Marie.,descriptive note,Nederlands
62ccb6fb-6a9b-5dac-bc49-abb29d259111,tg:lhph:28027,Descriptions,1,id.desc,Albert Poels; portret met deel van een van zijn beelden op de achtergrond.,descriptive note,Nederlands
6ec1da2d-4583-5293-88f1-c76437d1548b,tg:lhph:34004,Descriptions,1,id.desc,Lode Baekelmans in Kapellenbos.,descriptive note,Nederlands
cd09d4c3-25af-5561-8762-26e4c371535d,tg:lhph:49534,Descriptions,1,id.desc,Filmstill uit de kortfilm 'Flash back'(1952) die Herman Wuyts regisseerde.,descriptive note,Nederlands
470507dc-cda9-5b01-8f80-4e9a2e0a9c83,tg:lhph:18491,Descriptions,1,id.desc,Grafplaatje gevonden door Jotie T' Hooft. T'Hooft zou de naam Charles Louis d'Haene gebruiken als schuilnaam voor publicaties en literaire optredens.,descriptive note,Nederlands
d8e8fc3b-dc5f-5443-be6d-1fec5885a2ee,tg:lhph:7277,Descriptions,1,id.desc,Presentatie van Streuvels' werk tijdens de boekenbeurs.,descriptive note,Nederlands
2de84226-24be-516e-a22d-a55c654500d2,tg:lhph:36039,Descriptions,1,id.desc,"Koning Leopold III (midden) Doktor Dormal, Napoleon Dupuy, J.M. Crixent, Majoor Perz Terriero en Anibal Riviero tijdens het avondmaal te Santa Rosa.",descriptive note,Nederlands
53daec95-261a-531b-b983-828befa03b1f,tg:lhph:31206,Descriptions,1,id.desc,"Lode Jansen, sceneportet als monsterachtige figuur.",descriptive note,Nederlands
f2822252-6a97-530e-b98d-661eb587310e,tg:lhph:51807,Descriptions,1,id.desc,"Maria Elisabeth Belpaire, samen met Louisa Duykers.",descriptive note,Nederlands
70e4f6f0-5c0c-538b-b8e7-bd1a3119cdf6,tg:lhph:2075,Descriptions,1,id.desc,Guido Gezelle met elleboog op tafel.,descriptive note,Nederlands
de0ae20c-34a7-53eb-9206-5e74d9aa43e9,tg:lhph:50715,Descriptions,1,id.desc,Dolores Thijs zit aan tafel en geeft een interview in een studio. De twee interviewers zitten tegenover haar. Met de rug naar de camera toe.,descriptive note,Nederlands
3d21a7af-dc4f-54d8-9b12-07bf6f7c20a7,tg:lhph:52728,Descriptions,1,id.desc,Streuvels bij Huize Iepenburg (Schoten).,descriptive note,Nederlands
c6797a55-58f6-50a3-9b38-c50f86ad99e5,tg:lhph:38924,Descriptions,1,id.desc,"Pol Mara, portret, zittend naar rechts kijkend, met hooivork op de achtergrond.",descriptive note,Nederlands
24a70e85-4dbb-5f34-8e87-50d04f256552,tg:lhph:27628,Descriptions,1,id.desc,"Filip De Pillecyn; op zijn sterfbed, in tegenlicht.",descriptive note,Nederlands
55500cb0-6305-579f-8ff3-8133f9a2745f,tg:lhph:25615,Descriptions,1,id.desc,Tiefland van d'Albert(Barcelona). Anne-Marie Antoine als Martha.,descriptive note,Nederlands
968d517a-7719-574d-9764-0259bcb53ded,tg:lhph:24907,Descriptions,1,id.desc,"Luc Verbeke, profiel naar rechts. Hoofd en schouders.",descriptive note,Nederlands
09801a22-f927-590e-b9f5-ac094b363e5f,tg:lhph:12566,Descriptions,1,id.desc,"Toon Brouwers, borststuk, vooraanzicht.",descriptive note,Nederlands
4839a2c3-f543-5fc8-99cc-c3c7134d5113,tg:lhph:44306,Descriptions,1,id.desc,Co Flower op de luxejacht Femina.,descriptive note,Nederlands
37ef833c-a8d5-52e8-b45d-6183de426614,tg:lhph:8478,Descriptions,1,id.desc,"Katlijne"""" of """"De ongehuwde moeder"""", toneelstuk van Yvonne Waegemans.

Zittend rechts naast Katlijne, Yvonne Waegemans.",descriptive note,Nederlands
0f5e122d-d84f-5d7d-b935-df1547c60f46,tg:lhph:39636,Descriptions,1,id.desc,"De kinderen van van Louis Meeus en Clothilde Tysmans in de tuin, groepsfoto.",descriptive note,Nederlands
4ef702d9-1456-5261-8850-820808169b73,tg:lhph:27782,Descriptions,1,id.desc,"Cyriel Verschaeve en Modestus van Assche, voor de kerk, na de zielenis van Robrecht de Smet.",descriptive note,Nederlands
ae4a5f03-ffac-595b-812f-646b465de697,tg:lhph:46291,Descriptions,1,id.desc,"Inhuldiging pastoor Basiel de Craene, Merendree, 1938. Basiel de Craene wordt als nieuwe pastoor samen met zijn collega's in een paardenkoets door Merendree gereden.",descriptive note,Nederlands
413f2ca5-a867-5e5c-b3c6-35ce7205f5da,tg:lhph:43569,Descriptions,1,id.desc,"Leon Elaut, Kranslegging op het graf van F.A.Snellaert (op Campo Santo)

v.l.n.r: Dr. Leon Elaut, Dr. F. Comer, Prof. A. Deprez, Prof. A. van Elslander",descriptive note,Nederlands
cbff7b50-0d63-52c6-9727-efd7d548820e,tg:lhph:15309,Descriptions,1,id.desc,Alphonse Roersch tijdens de studiedag in het Museum.,descriptive note,Nederlands
2eb81bfc-5fc0-53e9-b9e0-128ca1d21220,tg:lhph:41554,Descriptions,1,id.desc,"August Borms met Raph English, zoon van Joe English, tijdens de IJzerbedevaart.",descriptive note,Nederlands
b3fa8b41-9478-5391-b97e-63fc9bef3c02,tg:lhph:17334,Descriptions,1,id.desc,"Willy van Heesvelde in """"Au bouillon Belge",descriptive note,Nederlands
bcf33c02-ac18-5673-841c-5e04ccb96bd9,tg:lhph:26890,Descriptions,1,id.desc,Jan Peeters; na de lezing van Dhr. Dehenuis tijdens een 'paedagogische week'.,descriptive note,Nederlands
d96eaf51-56ff-5365-b51f-b7c626dd9708,tg:lhph:49164,Descriptions,1,id.desc,Denise Libregs,descriptive note,Nederlands
a1a5c591-142e-5f15-92a4-64440e3fc4c0,tg:lhph:53990,Descriptions,1,id.desc,"Gentse literaire beurs in de salons van de opera. Geo Bruggen, Maurits de Doncker, Rik Lanckrock, José Vial, J. de Valckenaere, Adolf Herckenrath, J. Beyaert, Simonne Kuhnen, Paul de Ryck, Frank Meyland, Gaston Martens, René Ide, Jan Schepens, Jeanne Nowé, Paul Berkenman, Ploiet van Lishout, André Rodenbach, Johan Daisne en Michel van Vlaenderen.",descriptive note,Nederlands
f9a4758e-88ae-50c5-b6c2-6735a9e98cf8,tg:lhph:34454,Descriptions,1,id.desc,Alice van Walleghem. Borststuk.,descriptive note,Nederlands
f1d38d74-b3cb-5e0d-9d1f-61974558f167,tg:lhph:33391,Descriptions,1,id.desc,"Jan Keustermans, portret, hoofd.",descriptive note,Nederlands
eacaaa44-c060-57d2-89f1-927ad4e1fafc,tg:lhph:36469,Descriptions,1,id.desc,"Bert de Bels, vooraanzicht, hoofd.",descriptive note,Nederlands
aa991f06-8947-5c50-9da0-1e2db80bed84,tg:lhph:7627,Descriptions,1,id.desc,Banket van de Vereniging van Vlaamse Letterkundigen.,descriptive note,Nederlands
8297b535-2278-5fbb-abf5-405486f6f25a,tg:lhph:28477,Descriptions,1,id.desc,Frans Vinck. Borststuk.,descriptive note,Nederlands
a1b52101-6f2e-5e80-83c3-0875b5440d27,tg:lhph:6935,Descriptions,1,id.desc,"Abdij van St.Andries. Zevenkerken.

Uitzicht van een veranda.",descriptive note,Nederlands
f847d74e-3c66-5377-bb99-a14611b01a58,tg:lhph:4908,Descriptions,1,id.desc,Groepsfoto van leden van Antwerpen boven.,descriptive note,Nederlands
07bb1ea9-3a82-5bb9-9644-04093495a319,tg:lhph:52682,Descriptions,1,id.desc,Zuster Dymfna Gezelle (2e van rechts) met groep kinderen.,descriptive note,Nederlands
9f22706b-2354-589d-80e8-3575eeee9860,tg:lhph:50345,Descriptions,1,id.desc,Cees de Jong staat buiten voor een muur. Hij kijkt naar beneden.,descriptive note,Nederlands
97385054-6566-54b1-a59f-9b3568b02b7e,tg:lhph:32979,Descriptions,1,id.desc,De Kempen; s'Gravenwezel.,descriptive note,Nederlands
58dbae78-0cf4-55ea-ab00-887baf89e1c7,tg:lhph:30944,Descriptions,1,id.desc,"Karel H. Goddeeris, in profiel, tijdens een bijeenkomst (ijzerbedevaart?).",descriptive note,Nederlands
deebc22f-fb5f-540e-aa09-ad9bbc929639,tg:lhph:52378,Descriptions,1,id.desc,"Interieur Lijsternest, speelgoedhond. 


 ",descriptive note,Nederlands
ab7343c5-3a66-5f03-8682-312cb9341570,tg:lhph:31656,Descriptions,1,id.desc,Oscar Jespers op zijn sofa een boek aan het lezen.,descriptive note,Nederlands
d7565c2b-39f0-5ce0-b444-1ce69665823f,tg:lhph:36193,Descriptions,1,id.desc,"Arca-Kelderteater:

Twee onbekenden, in """"Het dienluik"""", door Fernando Arrabal, regie: Walter
Eysselinck .",descriptive note,Nederlands
27ec2153-e30d-5741-aaef-6b5fc440e17d,tg:lhph:2425,Descriptions,1,id.desc,Maurice Gilliams met aan zijn linkerkant mevrouw Rika de Backer en langs zijn rechterzijde Maria de Raeymaekers naar aanleiding van de viering Maurice Gilliams.,descriptive note,Nederlands
2c3f5e5f-7120-54ed-a941-9a801c424ae4,tg:lhph:43093,Descriptions,1,id.desc,Luc Anthierens zittend voor de open haard,descriptive note,Nederlands
2a827234-97f9-536c-901d-140927740463,tg:lhph:39266,Descriptions,1,id.desc,"Toneel S.O.L.:

Vijf meisjes, in het stuk """"Domme Hannes"""", door Jan Peeters.",descriptive note,Nederlands
30a17332-bc2c-59b6-a4f2-1c44811b5ef1,tg:lhph:44756,Descriptions,1,id.desc,"Mejuffrouw en Emma Lebègue, verwanten van Albert Daenens. In de duinen.",descriptive note,Nederlands
